id,name,phone,timeOpen,ratingAverage,details,rangePrice,Longitude,Latitude,address
508,Drunken Duck Bar,Chưa xác thực,,4.0,"Quầy bar, Quán rượu, Quốc tế, Bữa tối, Đồ uống, Chỗ ngồi, Phục vụ đồ uống có cồn, Dịch vụ bàn",400.000 vnd - 700.000 vnd,106.7046331,10.7801062,"Hẻm 17 Đường Thái Văn Lung, Phường Bến Nghé, Quận 1, Thành phố Hồ Chí Minh, 77000, Việt Nam"
509,Dtwo Sports Pub,+84 8 3519 4138,Đang mở cửa: 10:00 SA - 12:00 SA,4.0,"Quán rượu, Quán rượu đặc sản, Quầy bar, Kiểu Anh, Phù hợp với người ăn chay",100.000 vnd - 400.000 vnd,106.7279205,10.8033905,"Trường Quốc Tế Cấp 2 Campus, Đường Nguyễn Cừ, Phường Thảo Điền, Thành phố Thủ Đức, Thành phố Hồ Chí Minh, 71108, Việt Nam"
510,Du Bar - Perfume Cocktail Bar,+84 93 336 16 06,Đang đóng cửa:  Xem tất cả giờ,5.0,"Quầy bar, Quán rượu, Quầy rượu vang, Quán bar phục vụ đồ ăn, Bữa tối",400.000 vnd - 700.000 vnd,106.6850842,10.8060598,"Ministop, Nguyễn Thượng Hiền, Phường 6, Quận Bình Thạnh, Thành phố Hồ Chí Minh, 70048, Việt Nam"
511,Đu Đủ Xanh | Tiệm Chay . Vegetarian,+84 28 3824 3877,Đang mở cửa: 10:30 SA - 2:00 CH5:00 CH - 10:00 CH,5.0,"Kiểu Á, Kiểu Việt, Bữa trưa, Bữa tối, Đồ uống, Giao hàng, Cửa hàng bán thức ăn mang về, Đặt chỗ, Ngồi ngoài trời, Ăn tối phòng riêng, Chỗ ngồi, Có bãi đỗ xe, Bãi đỗ xe đường phố, Đỗ xe có người coi, Có ghế ăn cho bé, Lối vào ra cho xe",400.000 vnd - 700.000 vnd,106.6975593,10.773667,"Street Food Market, Hẻm 24 Thủ Khoa Huân, Phường Bến Thành, Quận 1, Thành phố Hồ Chí Minh, 71009, Việt Nam"
512,Du Mien Garden Cafe,+84 8 3894 5555,Đang mở cửa: 07:00 SA - 11:00 CH,4.0,"Cà phê, Kiểu Việt, Bữa sáng, Bữa trưa, Bữa tối, Ngồi ngoài trời, Chỗ ngồi",400.000 vnd - 700.000 vnd,106.6978843,10.7748416,"Quán Ăn Ruông, 33, Nguyễn Trung Trực, Phường Bến Thành, Quận 1, Thành phố Hồ Chí Minh, 71009, Việt Nam"
513,Duck Deli,+84 8 3821 5971,Đang mở cửa: 10:00 SA - 10:00 CH,3.5,"Kiểu Á, Kiểu Việt, Bữa trưa, Bữa tối",100.000 vnd - 400.000 vnd,106.70618,10.7744,"Khách sạn Renaissance Riverside Sài Gòn, 8-15, Đường Tôn Ðức Thắng, Phường Bến Nghé, Quận 1, Thành phố Hồ Chí Minh, 72806, Việt Nam"
514,Dzo Street Food Bar,+84 89 846 59 58,,4.5,"Kiểu Mỹ, Kiểu Âu, Kiểu Á, Kiểu Việt, Kiểu Singapore, Quán rượu, Phù hợp với người ăn chay",100.000 vnd - 400.000 vnd,106.7099539,10.7899591,"Sàn Art, Hẻm 48 Mê Linh, Phường 19, Quận Bình Thạnh, Thành phố Hồ Chí Minh, 77000, Việt Nam"
515,E:T Lounge,+84 8 2577 9939,Đang mở cửa: 6:00 CH - 03:00 SA,5.0,Bữa tối,400.000 vnd - 700.000 vnd,106.703606,10.7721592,"Silverland Charner, Hồ Tùng Mậu, Phường Bến Nghé, Quận 1, Thành phố Hồ Chí Minh, 00084, Việt Nam"
516,East By Ngô Thanh Hòa,+84 28 3636 5458,Đang mở cửa: 11:00 SA - 2:00 CH5:30 CH - 11:00 CH,5.0,"Kiểu Bữa tối, Bản địa, Bữa trưa, Bữa tối, Đồ uống",400.000 vnd - 700.000 vnd,106.7019901,10.7780202,"Vincom Center, Đường Lê Thánh Tôn, Phường Bến Nghé, Quận 1, Thành phố Hồ Chí Minh, 77000, Việt Nam"
517,East West Brewing Co.,+84 91 306 07 28,Đang mở cửa: 11:00 SA - 11:59 CH,4.5,"Kiểu Mỹ, Kiểu Việt, Nhà hàng bán bia, Quán rượu, Quán rượu đặc sản, Phù hợp với người ăn chay, Tùy chọn ăn chay, Tùy chọn đồ ăn không có gluten",700.000 vnd - 1.000.000 vnd,106.6818015,10.7822134,"Trường Tiểu học Kỳ Đồng, 24, Đường Bà Huyện Thanh Quan, Phường 9, Quận 3, Thành phố Hồ Chí Minh, 70150, Việt Nam"
518,Eat & Go Restaurant,+84 93 726 06 83,Đang mở cửa: 07:30 SA - 11:30 CH,5.0,"Kiểu Mỹ, Kiểu Việt, Bữa sáng, Bữa trưa, Bữa tối, Đồ uống, Giao hàng, Cửa hàng bán thức ăn mang về, Đặt chỗ, Ngồi ngoài trời, Chỗ ngồi, Bãi đỗ xe tập trung miễn phí, Phục vụ đồ uống có cồn, Rượu và bia, Wifi miễn phí, Chấp nhận thẻ tín dụn",400.000 vnd - 700.000 vnd,106.7484399,10.8018374,"Trung Tâm Thương Mại Estella, Đường Song Hành, Phường An Phú, Thành phố Thủ Đức, Thành phố Hồ Chí Minh, 71108, Việt Nam"
519,Eco Farm Cafe,+84 8 3914 1142,,5.0,Kiểu Việt,100.000 vnd - 400.000 vnd,106.7218601,10.7948902,"Vincom Center, 720A, Điện Biên Phủ, Phường 22, Quận Bình Thạnh, Thành phố Hồ Chí Minh, 71108, Việt Nam"
520,Eddie's D1 New York Diner & Deli,+84 28 2212 2389,Đang mở cửa: 08:00 SA - 10:00 CH,5.0,"Kiểu Mỹ, Cửa hàng thức ăn ngon, Kiểu Bữa tối, Thịt nướng, Bữa sáng, Bữa trưa, Bữa tối, Đồ uống, Giao hàng, Cửa hàng bán thức ăn mang về, Đặt chỗ, Chỗ ngồi, Có ghế ăn cho bé, Phục vụ đồ uống có cồn, Rượu và bia, Wifi miễn phí, Chấp nhận thẻ t",400.000 vnd - 700.000 vnd,106.7042185,10.7793421,"5KU Station, Đường Thái Văn Lung, Phường Bến Nghé, Quận 1, Thành phố Hồ Chí Minh, 77000, Việt Nam"
521,Eddies New York Deli & Diner,+84 28 2253 6705,Đang mở cửa: 08:00 SA - 10:00 CH,5.0,"Kiểu Mỹ, Kiểu Bữa tối, Phù hợp với người ăn chay, Tùy chọn ăn chay, Bữa sáng, Bữa trưa, Bữa tối, Bữa nửa buổi, Đồ uống",400.000 vnd - 700.000 vnd,106.6959503,10.7846722,"Familymart, Đường Hai Bà Trưng, Phường Đa Kao, Quận 1, Thành phố Hồ Chí Minh, 71006, Việt Nam"
522,Edwards Bistro,+84 8 2241 9100,Đang mở cửa: 08:00 SA - 10:00 CH,4.5,"Kiểu Việt, Pizza, Kiểu Á, Kiểu Anh, Bữa tối, Bữa sáng, Bữa trưa, Cửa hàng bán thức ăn mang về, Giao hàng, Chỗ ngồi, Dịch vụ bàn",400.000 vnd - 700.000 vnd,106.7116469,10.7930884,"Đại học Tôn Đức Thắng, 98, Đường Ngô Tất Tố, Phường 19, Quận Bình Thạnh, Thành phố Hồ Chí Minh, 77000, Việt Nam"
523,Eien Whisky Bar,+84 96 443 87 88,,4.5,"Kiểu Âu, Quán bar phục vụ đồ ăn, Phong cách ẩm thực Fusion Nhật Bản",100.000 vnd - 400.000 vnd,106.7036645,10.7779966,"Nhà Hàng Jaspas, Hẻm 74 Đường Hai Bà Trưng, Phường Bến Nghé, Quận 1, Thành phố Hồ Chí Minh, 71006, Việt Nam"
524,El Cafe Vegan Vegetarian Food,+84 366967213,Đang mở cửa: 09:00 SA - 10:00 CH,4.0,"Kiểu Ấn Độ, Quốc tế, Kiểu Địa Trung Hải, Kiểu Âu, Kiểu Á, Bữa sáng, Bữa trưa, Bữa tối, Bữa nửa buổi, Đồ uống",400.000 vnd - 700.000 vnd,106.6902814,10.7753458,"Saigon Star Hotel, 204, Đường Bà Huyện Thanh Quan, Phường Võ Thị Sáu, Quận 3, Thành phố Hồ Chí Minh, 70001, Việt Nam"
525,El Camino Taqueria - District 2,+84 93 755 67 78,Đang mở cửa: 11:00 SA - 10:30 CH,5.0,"Kiểu Á, Kiểu Hàn Quốc, Món kết hợp, Kiểu Mexico, Tùy chọn ăn chay",100.000 vnd - 400.000 vnd,106.7033494,10.777894,"Khách sạn Park Hyatt Sài Gòn, 2, Công Trường Lam Sơn, Phường Bến Nghé, Quận 1, Thành phố Hồ Chí Minh, 71006, Việt Nam"
526,"El Gaucho Argentinian Steakhouse - An Phu, Ho Chi Minh City",+84 98 121 49 21,Đang mở cửa: 11:00 SA - 10:00 CH,4.0,"Nhà hàng bít tết, Bữa trưa, Bữa tối, Đồ uống",1.000.000 vnd - 10.000.000 vnd,106.6912682,10.7896233,"Bánh Xèo 46A, 46A, Hẻm 87 Đường Nguyễn Hữu Cầu, Phường Tân Định, Quận 1, Thành phố Hồ Chí Minh, 72210, Việt Nam"
527,El Gaucho Argentinian Steakhouse - Hai Ba Trung,+84 28 3827 2090,Đang mở cửa: 11:00 SA - 11:00 CH,4.5,"Tùy chọn đồ ăn không có gluten, Bữa trưa, Bữa tối, Cửa hàng bán thức ăn mang về, Chỗ ngồi, Có ghế ăn cho bé, Phục vụ đồ uống có cồn, Quầy bar đầy đủ, Chấp nhận thẻ American Express, Chấp nhận thẻ Mastercard, Chấp nhận thẻ Visa, Wifi miễn phí, C",400.000 vnd - 700.000 vnd,106.70604,10.781076,"Nhà Hàng Mandarine, 11A, Ngô Văn Năm, Phường Bến Nghé, Quận 1, Thành phố Hồ Chí Minh, 77000, Việt Nam"
528,El Gaucho Argentinian Steakhouse - Le Loi,+84 97 154 22 27,Đang mở cửa: 11:00 SA - 10:30 CH,4.5,"Nhà hàng bít tết, Bữa trưa, Bữa tối, Đồ uống, Giao hàng, Ngồi ngoài trời, Chỗ ngồi, Rượu và bia, Wifi miễn phí",400.000 vnd - 700.000 vnd,106.712597,10.790069,"The Rabbit Hole Irish Sports Bar, Đường Phạm Viết Chánh, Phường 19, Quận Bình Thạnh, Thành phố Hồ Chí Minh, 77000, Việt Nam"
529,"El Gaucho Argentinian Steakhouse - Phu My Hung, Ho Chi Minh City",+84 28 5413 6909,Đang mở cửa: 11:00 SA - 11:00 CH,4.5,"Nhà hàng bít tết, Kiểu Argentina, Kiểu Nam Mỹ, Bữa trưa, Bữa tối, Đồ uống, Có thẻ quà tặng, Đặt chỗ, Chỗ ngồi, Có bãi đỗ xe, Quầy bar đầy đủ, Wifi miễn phí, Chấp nhận thẻ tín dụng, Dịch vụ bàn, Giao hàng, Cửa hàng bán thức ăn mang về,",400.000 vnd - 700.000 vnd,106.7040152,10.771145,"52, Hàm Nghi, Phường Bến Nghé, Quận 1, Thành phố Hồ Chí Minh, 00084, Việt Nam"
530,El Sol Meat & Wine,+84 97 242 07 30,Đang mở cửa: 11:00 SA - 10:30 CH,4.5,"Kiểu Mỹ, Kiểu Bữa tối, Kiểu Âu, Quầy rượu vang, Tùy chọn đồ ăn không có gluten",1612358 vnd - 5.000.000 vnd,106.6916598,10.7711059,"Bánh Mì Hồng Hoa, Nguyễn Văn Tráng, Phường Bến Thành, Quận 1, Thành phố Hồ Chí Minh, 70200, Việt Nam"
531,Elenoir Chocolate,+84 98 938 31 09,Đang mở cửa: 08:00 SA - 9:30 CH,4.5,"Cà phê, Bữa sáng, Bữa trưa, Bữa tối",400.000 vnd - 700.000 vnd,106.7042009,10.7720969,"Phường Bến Nghé, Quận 1, Thành phố Hồ Chí Minh, Việt Nam"
532,Elgin,+84 28 3535 2957,Đang mở cửa: 6:00 CH - 10:00 CH,5.0,"Quốc tế, Đương đại, Món kết hợp, Bữa tối, Đêm muộn, Đồ uống, Đặt chỗ, Chỗ ngồi, Có bãi đỗ xe, Bãi đỗ xe tập trung miễn phí, Phục vụ đồ uống có cồn, Rượu và bia, Chấp nhận thẻ American Express, Chấp nhận thẻ Mastercard, Chấp nhận thẻ Visa, Thanh",400.000 vnd - 700.000 vnd,106.6806076,10.7921478,"Khu Dân Cư Prince, Nguyễn Văn Trỗi, Phường 11, Quận Phú Nhuận, Thành phố Hồ Chí Minh, 70150, Việt Nam"
533,Elisa Floating Restaurant,+84 93 856 81 82,Đang mở cửa: 10:00 SA - 11:00 CH,3.5,"Kiểu Á, Kiểu Việt, Hải sản, Bữa trưa, Bữa tối",100.000 vnd - 400.000 vnd,106.7003489,10.7745782,"Khách Sạn Little Saigon Boutique, 36 Bis/2, Đường Lê Lợi, Phường Bến Nghé, Quận 1, Thành phố Hồ Chí Minh, 71006, Việt Nam"
534,Ember Bistro - Cafe & Restaurant -,+84 90 296 42 58,Đang mở cửa: 07:45 SA - 10:30 CH,4.0,"Kiểu Pháp, Thịt nướng, Phù hợp với người ăn chay, Tùy chọn ăn chay",100.000 vnd - 400.000 vnd,106.7349425,10.8064393,"Nhà Hàng Eddie's New York Diner, Đường Thảo Điền, Phường Thảo Điền, Thành phố Thủ Đức, Thành phố Hồ Chí Minh, 71108, Việt Nam"
535,Emergency Room Bar,+84 8 2215 1285,Đang mở cửa: 5:00 CH - 02:00 SA,4.0,"Kiểu Mỹ, Kiểu Anh, Quầy bar, Quán rượu, Pizza, Bữa tối, Đêm muộn, Đồ uống",100.000 vnd - 400.000 vnd,106.6816237,10.7701853,"Hẻm 51 Cao Thắng, Phường 3, Quận 3, Thành phố Hồ Chí Minh, 72406, Việt Nam"
536,Emoji Pizza,+84 1800 9228,Đang mở cửa: 10:00 SA - 10:00 CH,5.0,"Pizza, Bữa trưa, Bữa tối, Bữa nửa buổi, Đồ uống",100.000 vnd - 400.000 vnd,106.6976948,10.7688841,"Christina's Saigon Beatty's City Oasis, Hẻm 55 Lê Thị Hồng Gấm, Phường Nguyễn Thái Bình, Quận 1, Thành phố Hồ Chí Minh, 71010, Việt Nam"
537,EON51 Restaurant & Lounge,+84 28 6291 8751,Đang mở cửa: 5:00 CH - 11:00 CH,4.0,"Kiểu Âu, Kiểu Á, Kiểu Việt, Món kết hợp, Phù hợp với người ăn chay, Tùy chọn ăn chay, Tùy chọn đồ ăn không có gluten, Bữa trưa, Bữa tối, Đêm muộn, Đồ uống",400.000 vnd - 700.000 vnd,106.7060146,10.7737576,"Grand Hotel, Đường Ðồng Khởi, Phường Bến Nghé, Quận 1, Thành phố Hồ Chí Minh, 71006, Việt Nam"
538,Fang Pub,+84 90 240 26 66,,4.0,"Quán rượu, Đặt chỗ, Nhạc sống",400.000 vnd - 700.000 vnd,106.7026603,10.7754391,"Nhà Hàng Saigon Garden, 99, Đường Nguyễn Huệ, Phường Bến Nghé, Quận 1, Thành phố Hồ Chí Minh, 71006, Việt Nam"
539,Filthy Vegan,+(84)776810206,Đang mở cửa: 11:00 SA - 10:00 CH,5.0,"Đồ ăn nhanh, Kiểu Anh, Bữa sáng, Bữa trưa, Bữa tối",400.000 vnd - 700.000 vnd,106.7095596,10.7892075,"42, Đường Mê Linh, Phường 19, Quận Bình Thạnh, Thành phố Hồ Chí Minh, 77000, Việt Nam"
540,FIREWORKS Fresh Grill & Bar,+(84)028 9999 6268,Đang mở cửa: 07:00 SA - 12:00 SA,4.5,"Quầy bar, Đồ nướng, Quán rượu, Bữa sáng, Bữa trưa, Bữa tối, Đồ uống",700.000 vnd - 1.000.000 vnd,106.6935564,10.7860864,"Pizza & Bia, Đường Ðiện Biên Phủ, Phường Võ Thị Sáu, Quận 3, Thành phố Hồ Chí Minh, 70001, Việt Nam"
541,Flow Bar,+84 90 922 17 54,,5.0,"Quầy bar, Quán rượu",400.000 vnd - 700.000 vnd,106.7002539,10.7773874,"Nhà Hàng Hương Lài, 38, Lý Tự Trọng, Phường Bến Nghé, Quận 1, Thành phố Hồ Chí Minh, 71006, Việt Nam"
542,Fly to the moon,+84 8 3526 7760,,4.5,"Kiểu Nhật, Cà phê, Ngồi ngoài trời",100.000 vnd - 400.000 vnd,106.7315495,10.7165513,"Trường Mầm non Canada- Việt Nam, Đường Nội Khu Nam Thông 2D, Phường Tân Phú, Quận 7, Thành phố Hồ Chí Minh, 72915, Việt Nam"
543,Flying Pig Saigon,+84 28 2253 6778,,4.5,Món kết hợp,400.000 vnd - 700.000 vnd,106.7040803,10.7772014,"The Coffee Bean & Tea Leaf, 97, Hai Bà Trưng, Phường Bến Nghé, Quận 1, Thành phố Hồ Chí Minh, 71006, Việt Nam"
544,Food Creative,+84 8 3915 6266,,4.0,Kiểu Á,400.000 vnd - 700.000 vnd,106.6999017,10.777346,"Chung cư 158 Pasteur, Pastier, Phường Bến Nghé, Quận 1, Thành phố Hồ Chí Minh, 71006, Việt Nam"
545,Fork Saigon,+84 28 3823 3597,,4.5,"Kiểu Âu, Kiểu Tây Ban Nha, Kiểu Địa Trung Hải, Quầy rượu vang, Phù hợp với người ăn chay",100.000 vnd - 400.000 vnd,106.7054129,10.773665,"Nhà Hàng Jaspas, 33, Đường Ðồng Khởi, Phường Bến Nghé, Quận 1, Thành phố Hồ Chí Minh, 71006, Việt Nam"
546,Fox Beer Lounge,+84 91 397 97 39,,4.0,"Kiểu Việt, Chỗ ngồi",400.000 vnd - 700.000 vnd,106.690948,10.7659303,"Nhà Hàng Five Oysters, Đường Bùi Viện, Phường Phạm Ngũ Lão, Quận 1, Thành phố Hồ Chí Minh, 70200, Việt Nam"
547,Fresh Catch La Villa,+84 8 3940 6969,Đang mở cửa: 11:00 SA - 11:00 CH,4.5,"Hải sản, Kiểu Địa Trung Hải, Kiểu Ý, Kiểu Pháp, Kiểu Tây Ban Nha, Bữa trưa, Bữa tối, Đồ uống",100.000 vnd - 400.000 vnd,106.7033494,10.777894,"Khách sạn Park Hyatt Sài Gòn, 2, Công Trường Lam Sơn, Phường Bến Nghé, Quận 1, Thành phố Hồ Chí Minh, 71006, Việt Nam"
548,Fresh Origin Coffee,+(84)73043868,Đang mở cửa: 06:30 SA - 11:30 CH,4.0,"Kiểu Á, Kiểu Anh, Kiểu Việt, Tốt cho sức khỏe, Kiểu Ý, Cà phê, Bữa sáng, Bữa trưa, Bữa tối, Giao hàng, Cửa hàng bán thức ăn mang về, Đặt chỗ, Ngồi ngoài trời, Chỗ ngồi, Có bãi đỗ xe, Bãi đỗ xe có vé, Tivi, Chỉ chấp nhận tiền mặt, W",400.000 vnd - 700.000 vnd,106.6962558,10.7640995,"Soho Residence, Đường Ðề Thám, Phường Cầu Ông Lãnh, Quận 1, Thành phố Hồ Chí Minh, 71010, Việt Nam"
549,Fresh2Go,+84 8 3848 6707,Đang mở cửa: 12:00 SA - 11:59 CH,4.5,"Cà phê, Đồ ăn nhanh, Bữa sáng, Bữa trưa, Bữa nửa buổi, Đồ uống, Cửa hàng bán thức ăn mang về, Chỗ ngồi, Lối vào ra cho xe lăn, Chấp nhận thẻ tín dụng, Thanh toán điện tử, Wifi miễn phí",400.000 vnd - 700.000 vnd,106.7036649,10.7721181,"Khách Sạn Âu Lạc, Hồ Tùng Mậu, Phường Bến Nghé, Quận 1, Thành phố Hồ Chí Minh, 00084, Việt Nam"
550,Friends by Pontian,39146060,,3.5,"Kiểu Á, Bữa trưa",400.000 vnd - 700.000 vnd,106.6788647,10.7946453,"Nhà thờ Phú Lộc, Đường Duy Tân, Phường 15, Quận Phú Nhuận, Thành phố Hồ Chí Minh, 70150, Việt Nam"
551,Fuji Sushi,+84 93 887 23 56,Đang mở cửa: 10:00 SA - 10:00 CH,4.5,"Kiểu Nhật, Sushi, Kiểu Bữa tối, Bữa trưa, Bữa tối, Đồ uống",100.000 vnd - 400.000 vnd,106.694964,10.7798529,"Gloria Jean's, 106, Nguyễn Thị Minh Khai, Phường Võ Thị Sáu, Quận 3, Thành phố Hồ Chí Minh, 71006, Việt Nam"
552,Fujiro,+84 98 399 42 20,Đang mở cửa: 11:00 SA - 10:00 CH,4.0,"Kiểu Nhật, Kiểu Á, Bữa trưa, Bữa tối, Chỗ ngồi, Wifi miễn phí, Dịch vụ bàn",400.000 vnd - 700.000 vnd,106.6796948,10.7248811,"Phạm Hùng, Xã Bình Hưng, Huyện Bình Chánh, Thành phố Hồ Chí Minh, 73009, Việt Nam"
553,Fujiya Yakiniku Nabe Buffet,+84 93 812 25 52,,3.5,"Đồ nướng, Sushi, Kiểu Á, Kiểu Nhật, Bữa tối, Bữa trưa, Đặt chỗ, Chỗ ngồi, Lối vào ra cho xe lăn",400.000 vnd - 700.000 vnd,106.7047071,10.7803131,"Hẻm 15B Đường Lê Thánh Tôn, Phường Bến Nghé, Quận 1, Thành phố Hồ Chí Minh, 77000, Việt Nam"
554,Fujiyama,+84 28 3827 7747,Đang mở cửa: 11:30 SA - 3:00 CH5:00 CH - 11:00 CH,5.0,"Kiểu Nhật, Bữa tối, Bữa trưa",400.000 vnd - 700.000 vnd,106.6968594,10.7931814,"The Coffee House, 62, Hoàng Sa, Phường Tân Định, Quận 1, Thành phố Hồ Chí Minh, 72210, Việt Nam"
555,Fume,+84 93 849 49 54,Đang mở cửa: 5:30 CH - 10:00 CH,4.5,"Kiểu Pháp, Kiểu Nhật, Bữa tối, Bữa trưa, Đặt chỗ",700.000 vnd - 1.000.000 vnd,106.6159522,10.808883,"Lê Trọng Tấn, Phường Sơn Kỳ, Quận Tân Phú, Thành phố Hồ Chí Minh, 72011, Việt Nam"
556,Fuwagori - Kem Bông,+84 90 284 05 78,Đang mở cửa: 1:00 CH - 10:00 CH,5.0,"Cà phê, Đồ ăn nhanh, Bữa trưa, Bữa tối, Cửa hàng bán thức ăn mang về, Ngồi ngoài trời",400.000 vnd - 700.000 vnd,106.7459941,10.8025795,"Xa lộ Hà Nội, Phường Thảo Điền, Thành phố Thủ Đức, Thành phố Hồ Chí Minh, 71108, Việt Nam"
557,G5 RESTAURANT & LOUNGE,+84 70 6621 017,Đang mở cửa: 10:00 SA - 11:45 CH,5.0,"Kiểu Pháp, Kiểu Mexico, Kiểu Mỹ, Kiểu Việt, Quầy rượu vang, Bữa tối, Bữa trưa, Bữa nửa buổi, Đêm muộn, Đồ uống",100.000 vnd - 400.000 vnd,106.7323097,10.8064331,"Đường Số 65, Phường Thảo Điền, Thành phố Thủ Đức, Thành phố Hồ Chí Minh, 71107, Việt Nam"
558,Gà Cơ Bắp,+84 93 711 71 92,,5.0,Kiểu Việt,100.000 vnd - 400.000 vnd,106.7006058,10.7731248,"Trung tâm mua sắm Saigon Centre, Nam Kỳ Khởi Nghĩa, Phường Bến Nghé, Quận 1, Thành phố Hồ Chí Minh, 00084, Việt Nam"
559,Gà Nướng Pháp L'Etoile,+84 8 3839 9226,,3.5,"Kiểu Pháp, Đặt chỗ",400.000 vnd - 700.000 vnd,106.6921053,10.7922537,"Thế Giới Di Động, 130, Đường Trần Quang Khải, Phường Tân Định, Quận 1, Thành phố Hồ Chí Minh, 72210, Việt Nam"
560,Gà rán Texas Chicken,+84 8 3830 9323,,3.5,Món kết hợp,400.000 vnd - 700.000 vnd,106.6901266,10.7942884,"Hẻm 53/1 Trần Khánh Dư, Phường Tân Định, Quận 1, Thành phố Hồ Chí Minh, 72210, Việt Nam"
561,Galbi Brothers,+84 8 5410 6210,Đang mở cửa: 11:00 SA - 11:00 CH,4.0,"Đồ nướng, Kiểu Á, Kiểu Hàn Quốc, Món kết hợp, Bữa tối, Bữa trưa, Đặt chỗ, Chỗ ngồi, Dịch vụ bàn",400.000 vnd - 700.000 vnd,106.7055148,10.7818522,"10, Lê Thánh Tôn, Phường Bến Nghé, Quận 1, Thành phố Hồ Chí Minh, 71006, Việt Nam"
562,Gammer Beer,+84 28 3824 8619,,3.5,"Quầy bar, Kiểu Á, Nhà hàng bán bia, Quán rượu, Kiểu Việt, Bữa tối, Bữa trưa, Đêm muộn, Đồ uống, Đặt chỗ, Ngồi ngoài trời, Chỗ ngồi, Tivi, Phục vụ đồ uống có cồn, Dịch vụ bàn",400.000 vnd - 700.000 vnd,106.6781865,10.7890453,"Techcom, Đường Trần Quang Diệu, Phường 14, Quận 3, Thành phố Hồ Chí Minh, 70150, Việt Nam"
563,Gammer Beerhouse,+84 90 148 88 72,,4.5,"Kiểu Âu, Kiểu Á, Kiểu Việt, Kiểu Séc, Kiểu Trung Á",100.000 vnd - 400.000 vnd,106.6653643,10.7966305,"298, Lê Văn Sỹ, Phường 13, Quận 3, Thành phố Hồ Chí Minh, 70150, Việt Nam"
564,Ganesh,+84 8 5410 1627,,4.0,"Kiểu Ấn Độ, Kiểu Á, Phù hợp với người ăn chay, Tùy chọn ăn chay, Bữa nửa buổi, Bữa trưa, Bữa tối",400.000 vnd - 700.000 vnd,106.6818454,10.7552455,"Hẻm 110 Đường Trần Bình Trọng, Phường 1, Quận 5, Thành phố Hồ Chí Minh, 70200, Việt Nam"
565,Gangnam BBQ,+84 8 5410 7218,,4.5,"Kiểu Á, Kiểu Hàn Quốc, Đồ nướng, Đặt chỗ",400.000 vnd - 700.000 vnd,106.6828148,10.7844559,"Hẻm 10 Kỳ Ðồng, Phường 9, Quận 3, Thành phố Hồ Chí Minh, 70150, Việt Nam"
566,Ganh,+84 28 3829 5243,Đang mở cửa: 08:00 SA - 11:00 CH,4.0,"Kiểu Á, Kiểu Việt, Phù hợp với người ăn chay, Bữa trưa, Bữa tối, Bữa sáng",400.000 vnd - 700.000 vnd,106.702176,10.773603,"Chung cư 42 Tôn Thất Thiệp, 42, Tôn Thất Thiệp, Phường Bến Nghé, Quận 1, Thành phố Hồ Chí Minh, 00084, Việt Nam"
567,GÁNH - Vietnamse Cuisine,+84 93 716 66 18,Đang mở cửa: 08:00 SA - 11:00 CH,4.0,"Kiểu Việt, Kiểu Á, Tốt cho sức khỏe, Bữa trưa, Bữa nửa buổi, Bữa sáng, Bữa tối",400.000 vnd - 700.000 vnd,106.6875183,10.7688702,"Khách Sạn Stuck In Saigon, Lương Hữu Khánh, Phường Phạm Ngũ Lão, Quận 1, Thành phố Hồ Chí Minh, 70200, Việt Nam"
568,Gánh Đậu - Galaxy Nguyễn Văn Quá,+84 28 6683 3331,Đang mở cửa: 10:00 SA - 10:00 CH,5.0,"Bữa trưa, Bữa tối",400.000 vnd - 700.000 vnd,106.6966003,10.78717,"Đường Nguyễn Văn Thủ, Phường Đa Kao, Quận 1, Thành phố Hồ Chí Minh, 77000, Việt Nam"
569,Gánh Restaurant,+84 28 6682 0696,Đang mở cửa: 10:00 SA - 11:00 CH,3.5,"Kiểu Á, Kiểu Việt, Phù hợp với người ăn chay, Bữa tối, Bữa trưa",400.000 vnd - 700.000 vnd,106.6844566,10.7704974,"Hẻm 339 Nguyễn Ðình Chiểu, Phường 5, Quận 3, Thành phố Hồ Chí Minh, 72406, Việt Nam"
570,Garden Brasserie,84 8 842 1111,,4.5,"Kiểu Pháp, Hải sản, Bữa sáng, Bữa trưa, Bữa tối, Đặt chỗ, Chỗ ngồi",400.000 vnd - 700.000 vnd,106.687776,10.770482,"Hẻm 25 Tôn Thất Tùng, Phường Phạm Ngũ Lão, Quận 1, Thành phố Hồ Chí Minh, 70200, Việt Nam"
571,"Gardenia - Eat, Play, Love",+84 90 297 87 88,Đang mở cửa: 10:00 SA - 11:00 CH,4.0,"Kiểu Âu, Bữa trưa, Bữa tối, Sân chơi",400.000 vnd - 700.000 vnd,106.6877466,10.7719026,"Lotteria, Nguyễn Thị Minh Khai, Phường 5, Quận 3, Thành phố Hồ Chí Minh, 70200, Việt Nam"
572,Garni Bistro,+84 896 679 788,Đang mở cửa: 09:00 SA - 3:00 CH5:00 CH - 10:00 CH,5.0,"Kiểu Pháp, Kiểu Âu, Kiểu Việt, Bữa sáng, Bữa trưa, Bữa tối, Bữa nửa buổi, Đồ uống",400.000 vnd - 700.000 vnd,106.6757422,10.7889291,"KFC, Đường Lê Văn Sỹ, Phường 12, Quận 3, Thành phố Hồ Chí Minh, 70150, Việt Nam"
573,Gartenstadt Restaurant,+84 28 3822 3623,Đang mở cửa: 10:30 SA - 11:00 CH,4.0,"Kiểu Đức, Quầy bar, Kiểu Âu, Kiểu Trung Âu, Bữa trưa, Bữa tối, Đêm muộn, Chỗ ngồi, Tivi, Lối vào ra cho xe lăn, Phục vụ đồ uống có cồn, Quầy bar đầy đủ, Wifi miễn phí, Dịch vụ bàn, Giao hàng, Cửa hàng bán thức ăn mang về, Đặt chỗ",400.000 vnd - 700.000 vnd,106.6893278,10.7719202,"Siberia Wellness, Sương Nguyệt Anh, Phường Bến Thành, Quận 1, Thành phố Hồ Chí Minh, 70200, Việt Nam"
574,Gaxeo 3,+84 8 2253 1596,,3.5,"Kiểu Hàn Quốc, Kiểu Á, Bữa tối, Bữa trưa, Cửa hàng bán thức ăn mang về, Chỗ ngồi",400.000 vnd - 700.000 vnd,106.6840371,10.7840498,"Bệnh viện Tai Mũi Họng TP.HCM, 153-155-157, Đường Trần Quốc Thảo, Phường Võ Thị Sáu, Quận 3, Thành phố Hồ Chí Minh, 70001, Việt Nam"
575,Gentle Onion,+84 28 5412 5475,Đang mở cửa: 10:00 SA - 10:00 CH,4.5,"Kiểu Ý, Kiểu Mỹ, Kiểu Á, Kiểu Hàn Quốc, Món kết hợp, Kiểu Việt, Bữa trưa, Bữa tối",100.000 vnd - 400.000 vnd,106.734361,10.8066738,"Nhà Hàng Pasha Garden Lounge, 37, Tống Hữu Định, Phường Thảo Điền, Thành phố Thủ Đức, Thành phố Hồ Chí Minh, 71108, Việt Nam"
