id,name,phone,timeOpen,ratingAverage,details,rangePrice,Longitude,Latitude,address
1503,Quán Ăn Út Cà Mau,+84 8 3832 2742,,4.0,"Kiểu Việt, Hải sản",400.000 vnd - 700.000 vnd,106.701935,10.769544,"Ocean, Nam Kỳ Khởi Nghĩa, Phường Nguyễn Thái Bình, Quận 1, Thành phố Hồ Chí Minh, 71010, Việt Nam"
1504,Quán Bánh Bèo Ngọc Sơn,+84 8 3853 7486,Đang mở cửa: 09:00 SA - 9:00 CH,4.5,"Bữa sáng, Bữa trưa, Bữa tối",400.000 vnd - 700.000 vnd,106.689132,10.7659012,"Trường Đại học Sân khấu - Điện ảnh Thành phố Hồ Chí Minh, 125, Đường Cống Quỳnh, Phường Nguyễn Cư Trinh, Quận 1, Thành phố Hồ Chí Minh, 70200, Việt Nam"
1505,Quán Bánh Canh Bến Có,+84 96 411 39 39,Đang mở cửa: 06:00 SA - 8:00 CH,4.5,"Kiểu Việt, Bữa sáng, Bữa trưa, Bữa tối",400.000 vnd - 700.000 vnd,106.6132133,10.7531379,"165, Đường số 19, Phường Bình Trị Đông B, Quận Bình Tân, Thành phố Hồ Chí Minh, 73118, Việt Nam"
1506,Quán Bánh Khọt Cô Ba Vũng Tàu,+84 90 786 82 46,Đang mở cửa: 08:00 SA - 11:00 CH,4.0,"Kiểu Á, Kiểu Việt, Phù hợp với người ăn chay, Bữa trưa, Bữa tối, Bữa nửa buổi, Đồ uống",400.000 vnd - 700.000 vnd,106.6804031,10.7712947,"Hẻm 67 Cao Thắng, Phường 3, Quận 3, Thành phố Hồ Chí Minh, 72406, Việt Nam"
1507,Quán Bánh Việt - Vietnamese Cakes,+84 97 720 53 60,Đang mở cửa: 10:00 SA - 9:00 CH,5.0,"Kiểu Việt, Bữa trưa, Bữa tối",20.000 vnd - 99.000 vnd,106.6928858,10.7971171,"Phan Xích Long, Phường 2, Quận Phú Nhuận, Thành phố Hồ Chí Minh, 72210, Việt Nam"
1508,Quán bar Dailo's,+84 90 960 11 18,Đang mở cửa: 09:00 SA - 12:00 SA,4.5,"Kiểu Pháp, Nhà hàng bít tết, Pizza, Kiểu Á, Món kết hợp, Quầy bar, Bữa trưa, Bữa tối, Đồ uống",400.000 vnd - 700.000 vnd,106.704273,10.771445,"Phường Bến Nghé, Quận 1, Thành phố Hồ Chí Minh, Việt Nam"
1509,Quán Bar Zen Rooftop,+84 8 3925 7257,,4.5,"Quốc tế, Quầy bar, Kiểu Á, Quán rượu, Bữa sáng, Bữa tối, Bữa nửa buổi",700.000 vnd - 1.000.000 vnd,106.7073398,10.7318267,"Cà Phê Osaka-Hunten, Cao Triều Phát, Phường Tân Phong, Quận 7, Thành phố Hồ Chí Minh, 72915, Việt Nam"
1510,Quán Bia Lac Brewing Co,+84 88 641 00 08,Đang mở cửa: 4:00 CH - 12:00 SA,4.0,"Kiểu Á, Bữa tối, Đêm muộn, Đồ uống",100.000 vnd - 400.000 vnd,106.7015984,10.7689848,"Hẻm 158 Nguyễn Công Trứ, Phường Nguyễn Thái Bình, Quận 1, Thành phố Hồ Chí Minh, 71010, Việt Nam"
1511,Quán BiaCraft Artisan Ales - Lê Ngoô Cát,+84 8 3933 0903,Đang mở cửa: 11:00 SA - 11:00 CH,4.5,"Nhà hàng bán bia, Quầy bar, Quốc tế, Quán rượu, Quán rượu đặc sản, Bữa trưa, Bữa tối, Đồ uống, Chỗ ngồi, Bãi đỗ xe đường phố, Bãi đỗ xe tập trung miễn phí, Phục vụ đồ uống có cồn, Rượu và bia, Chấp nhận thẻ Mastercard, Chấp nhận thẻ Visa, W",400.000 vnd - 700.000 vnd,106.7039571,10.7427187,"274, Đường Lê Văn Lương, Phường Tân Hưng, Quận 7, Thành phố Hồ Chí Minh, 72800, Việt Nam"
1512,Quán Bụi,+84 8 3829 1515,Đang mở cửa: 07:00 SA - 11:00 CH,4.5,"Kiểu Việt, Phù hợp với người ăn chay, Tùy chọn ăn chay, Tùy chọn đồ ăn không có gluten",100.000 vnd - 400.000 vnd,106.7128231,10.8097712,"Ung Văn Khiêm, Phường 25, Quận Bình Thạnh, Thành phố Hồ Chí Minh, 72309, Việt Nam"
1513,Quán Bụi Bistro & Lounge,+84 28 6684 7706,Đang mở cửa: 07:00 SA - 11:00 CH,4.5,"Kiểu Việt, Phù hợp với người ăn chay, Tùy chọn ăn chay, Tùy chọn đồ ăn không có gluten",100.000 vnd - 400.000 vnd,106.696559,10.7832959,"Cục Công tác phía Nam - Bộ Công thương, 45, Trần Cao Vân, Phường Võ Thị Sáu, Quận 3, Thành phố Hồ Chí Minh, 77000, Việt Nam"
1514,Quán Bụi Central,+84 28 3910 1055,Đang mở cửa: 07:00 SA - 11:00 CH,4.5,"Kiểu Việt, Phù hợp với người ăn chay, Bữa trưa, Bữa tối, Bữa sáng, Bữa nửa buổi, Đồ uống",400.000 vnd - 700.000 vnd,106.6966003,10.78717,"Đường Nguyễn Văn Thủ, Phường Đa Kao, Quận 1, Thành phố Hồ Chí Minh, 77000, Việt Nam"
1515,Quán Bụi Garden,+84 91 400 88 35,Đang mở cửa: 07:00 SA - 11:00 CH,4.5,"Kiểu Á, Kiểu Việt, Phù hợp với người ăn chay, Tùy chọn ăn chay, Tùy chọn đồ ăn không có gluten",100.000 vnd - 400.000 vnd,106.7329202,10.8051548,"Soma Art Lounge, Đường Lê Văn Miễn, Phường Thảo Điền, Thành phố Thủ Đức, Thành phố Hồ Chí Minh, 71108, Việt Nam"
1516,Quán Bún Mộc Thanh Mai,Chưa xác thực,,4.0,"Kiểu Á, Kiểu Việt",400.000 vnd - 700.000 vnd,106.6913619,10.7660863,"Nhà Hàng - Cà Phê Lá Vàng, Đường Bùi Viện, Phường Phạm Ngũ Lão, Quận 1, Thành phố Hồ Chí Minh, 70200, Việt Nam"
1517,Quán C.On Global Food Factory,+84 8 3933 0934,Đang mở cửa: 06:30 SA - 11:00 CH,4.5,"Quốc tế, Cà phê, Kiểu Á, Kiểu Việt, Phù hợp với người ăn chay, Tùy chọn ăn chay",100.000 vnd - 400.000 vnd,106.7044307,10.7773916,"THAI CONG INTERIOR DESIGN, Nguyễn Siêu, Phường Bến Nghé, Quận 1, Thành phố Hồ Chí Minh, 71006, Việt Nam"
1518,Quán cà phê Highlands Coffee,+84 8 3930 7555,,4.0,"Cà phê, Cửa hàng bán thức ăn mang về, Chỗ ngồi",400.000 vnd - 700.000 vnd,106.6859323,10.756871,"Vietcombank, Hẻm 577 Trần Hưng Đạo, Phường Cầu Kho, Quận 1, Thành phố Hồ Chí Minh, 70200, Việt Nam"
1519,Quán Cà Phê Lam,+84 28 3837 0854,,4.5,"Kiểu Việt, Kiểu Hàn Quốc, Phù hợp với người ăn chay, Tùy chọn ăn chay, Bữa sáng, Bữa trưa, Bữa tối, Bữa nửa buổi, Đêm muộn, Đồ uống",400.000 vnd - 700.000 vnd,106.6975964,10.7867587,"Nhà Hàng The Gangs, Nguyễn Đình Chiểu, Phường Đa Kao, Quận 1, Thành phố Hồ Chí Minh, 77000, Việt Nam"
1520,Quán cà phê Miyama,+84 8 2253 1076,Đang mở cửa: 09:30 SA - 9:45 CH,4.5,"Kiểu Âu, Kiểu Bữa tối, Cà phê, Quán phục vụ đồ ngọt Nhật Bản, Phong cách ẩm thực Fusion Nhật Bản, Phù hợp với người ăn chay, Tùy chọn ăn chay, Tùy chọn đồ ăn không có gluten",100.000 vnd - 400.000 vnd,106.6747938,10.7679186,"Sushi, Ngã Bảy Lý Thái Tổ, Phường 1, Quận 3, Thành phố Hồ Chí Minh, 72406, Việt Nam"
1521,Quán cafe Saigon Vieux,+84 98 910 46 33,Đang mở cửa: 09:00 SA - 10:00 CH,4.5,"Cà phê, Kiểu Việt, Đồ uống, Bữa sáng, Bữa trưa, Bữa tối, Bữa nửa buổi",100.000 vnd - 400.000 vnd,106.6918576,10.7709398,"Tòa nhà Zen Plaza, 54 - 56, Đường Nguyễn Trãi, Phường Bến Thành, Quận 1, Thành phố Hồ Chí Minh, 70200, Việt Nam"
1522,Quán cafe Tandem,+84 90 310 86 19,,5.0,Cà phê,400.000 vnd - 700.000 vnd,106.7452706,10.6840281,"Đường Huỳnh Tấn Phát, Xã Phú Xuân, Huyện Nhà Bè, Thành phố Hồ Chí Minh, 72915, Việt Nam"
1523,Quán cafe The Marker,+84 93 181 77 02,,4.0,"Cà phê, Phù hợp với người ăn chay, Bữa sáng, Bữa trưa, Bữa nửa buổi",400.000 vnd - 700.000 vnd,106.7043912,10.7719839,"Bitexco Financial Tower, 02, Hải Triều, Phường Bến Nghé, Quận 1, Thành phố Hồ Chí Minh, 00084, Việt Nam"
1524,Quán cafe Xanh,+84 8 3930 3252,Đang mở cửa: 07:00 SA - 10:00 CH,4.5,"Bữa sáng, Bữa trưa, Bữa tối",400.000 vnd - 700.000 vnd,106.700608,10.7749521,"The Old Compass Cafe and Bar, 63/11 Floor 3, Đường Pasteur, Phường Bến Nghé, Quận 1, Thành phố Hồ Chí Minh, 00084, Việt Nam"
1525,Quán Chả Cá Lá Vọng,Chưa xác thực,,4.0,"Kiểu Việt, Kiểu Á, Bữa trưa, Bữa tối, Đặt chỗ, Chỗ ngồi, Dịch vụ bàn",400.000 vnd - 700.000 vnd,106.681465,10.7666238,"33, Đường Nguyễn Thiện Thuật, Phường 2, Quận 3, Thành phố Hồ Chí Minh, 72406, Việt Nam"
1526,Quán Chấm Bánh Mì,+84 868 790 989,Đang mở cửa: 07:00 SA - 8:00 CH,4.0,"Kiểu Âu, Bữa sáng, Bữa trưa, Bữa tối",100.000 vnd - 400.000 vnd,106.700243,10.729419,"Đường Nguyễn Hữu Thọ, Phường Tân Phong, Quận 7, Thành phố Hồ Chí Minh, 72915, Việt Nam"
1527,Quán Chụyy,+84 93 279 47 83,Đang mở cửa: 09:00 SA - 9:00 CH,5.0,"Kiểu Việt, Kiểu Bữa tối, Bữa sáng, Bữa trưa, Bữa tối",20.000 vnd - 99.000 vnd,106.702514,10.7888806,"Hẻm 10 Nguyễn Thị Minh Khai, Phường Đa Kao, Quận 1, Thành phố Hồ Chí Minh, 77000, Việt Nam"
1528,Quán Cơm Gà Hài Nam,+84 8 3853 2211,,4.0,"Kiểu Trung Quốc, Kiểu Á, Kiểu Việt, Kiểu Singapore, Kiểu Malaysia",400.000 vnd - 700.000 vnd,106.6914237,10.7804195,"Sushi Hokkaido Sachi - Nguyễn Đình Chiểu, Đường Lê Quý Đôn, Phường Võ Thị Sáu, Quận 3, Thành phố Hồ Chí Minh, 70001, Việt Nam"
1529,Quán Cơm Xã Hội Nụ Cười,+84 8 3826 7065,,5.0,Món kết hợp,400.000 vnd - 700.000 vnd,106.6992551,10.7740167,"Lounge, Nguyễn Trung Trực, Phường Bến Thành, Quận 1, Thành phố Hồ Chí Minh, 71009, Việt Nam"
1530,Quán Daks Chicken,+84 8 5410 0715,,4.0,Món kết hợp,400.000 vnd - 700.000 vnd,106.6966162,10.7816904,"安贡馆, Phạm Ngọc Thạch, Phường Võ Thị Sáu, Quận 3, Thành phố Hồ Chí Minh, 71006, Việt Nam"
1531,Quan Dat,+84 93 406 09 20,Đang mở cửa: 09:00 SA - 11:00 CH,4.5,"Kiểu Á, Kiểu Việt, Bữa tối, Bữa sáng, Bữa trưa, Chỗ ngồi, Dịch vụ bàn",400.000 vnd - 700.000 vnd,106.738387,10.801992,"Giải Trí Rainbow Divers, Đường Thảo Điền, Phường Thảo Điền, Thành phố Thủ Đức, Thành phố Hồ Chí Minh, 71108, Việt Nam"
1532,Quán Fresh Corner,+84 90 390 31 05,Đang mở cửa: 07:00 SA - 10:30 CH,4.5,"Cà phê, Kiểu Á, Kiểu Việt, Bữa sáng, Bữa trưa, Bữa tối, Giao hàng, Cửa hàng bán thức ăn mang về, Ngồi ngoài trời, Chỗ ngồi, Có bãi đỗ xe, Bãi đỗ xe tập trung miễn phí, Có ghế ăn cho bé, Phục vụ đồ uống có cồn, Rượu và bia, Chấp nhận thẻ Ma",400.000 vnd - 700.000 vnd,106.7046492,10.7767492,"Cửa Hàng Saigon Heritage Spa, Hai Bà Trưng, Phường Bến Nghé, Quận 1, Thành phố Hồ Chí Minh, 71006, Việt Nam"
1533,Quán Gỗ,0762 36 36 46,,5.0,Kiểu Việt,100.000 vnd - 400.000 vnd,106.7031015,10.7760489,"151, Đường Ðồng Khởi, Phường Bến Nghé, Quận 1, Thành phố Hồ Chí Minh, 71006, Việt Nam"
1534,Quán Hải Hội,Chưa xác thực,,4.0,Kiểu Việt,100.000 vnd - 400.000 vnd,106.7192025,10.7955236,"Vinhomes Central Park, Phường 22, Quận Bình Thạnh, Thành phố Hồ Chí Minh, 71108, Việt Nam"
1535,Quan Hoa Dong,+84 8 3823 7647,Đang mở cửa: 4:00 CH - 10:00 CH,4.0,"Kiểu Á, Kiểu Việt, Bữa trưa, Bữa tối, Bữa sáng, Bữa nửa buổi, Cửa hàng bán thức ăn mang về, Phục vụ đồ uống có cồn, Chỗ ngồi",400.000 vnd - 700.000 vnd,106.6958918,10.7883534,"Nhà Hàng Nhật Manmaru, Mạc Đĩnh Chi, Phường Đa Kao, Quận 1, Thành phố Hồ Chí Minh, 72210, Việt Nam"
1536,Quán Hủ Tiếu Nam Vang - Trường Phát - Trương Công Định,Chưa xác thực,Đang mở cửa: 05:00 SA - 11:00 SA4:00 CH - 11:00 CH,4.5,"Bữa sáng, Bữa tối",400.000 vnd - 700.000 vnd,106.705524,10.78256,"Viet Nga Building, Tôn Đức Thắng, Phường Bến Nghé, Quận 1, Thành phố Hồ Chí Minh, 77000, Việt Nam"
1537,Quán iMì Quảng Mỹ Sơn,+84 28 3931 1789,,3.5,Kiểu Việt,100.000 vnd - 400.000 vnd,106.7184276,10.7909873,"Saigon Pearl, 92, Nguyễn Hữu Cảnh, Phường 22, Quận Bình Thạnh, Thành phố Hồ Chí Minh, 71108, Việt Nam"
1538,Quán Kim's Hideaway,+84 90 925 50 03,,4.0,"Kiểu Ý, Kiểu Nhật, Kiểu Á, Kiểu Thái, Kiểu Hàn Quốc, Kiểu Việt",400.000 vnd - 700.000 vnd,106.7191793,10.727837,"Crescent Residence 1, 103, Đường Tôn Dật Tiên, Phường Tân Phong, Quận 7, Thành phố Hồ Chí Minh, 72915, Việt Nam"
1539,Quán Loan,+84 8 3829 6934,,4.5,Kiểu Việt,100.000 vnd - 400.000 vnd,106.7202131,10.7398289,"Hẻm 118 Đường Nguyễn Thị Thập, Phường Bình Thuận, Quận 7, Thành phố Hồ Chí Minh, 72915, Việt Nam"
1540,Quán Marukame Udon Gò Vấp,+84 93 752 80 77,,4.0,Kiểu Nhật,20.000 vnd - 99.000 vnd,106.718278,10.795445,"Nguyễn Hữu Cảnh, Phường 22, Quận Bình Thạnh, Thành phố Hồ Chí Minh, 71108, Việt Nam"
1541,Quán Mr. Ya Bon,+84 94 929 89 59,Đang mở cửa: 07:00 SA - 10:00 CH,4.5,"Kiểu Pháp, Bữa sáng, Bữa trưa, Bữa tối",100.000 vnd - 400.000 vnd,106.6882569,10.7673063,"Cà Phê Soybean, Đường Lê Lai, Phường Phạm Ngũ Lão, Quận 1, Thành phố Hồ Chí Minh, 70200, Việt Nam"
1542,Quán Nam Giao,+84 8 3925 9996,Đang mở cửa: 07:00 SA - 10:00 CH,4.0,"Kiểu Việt, Súp, Kiểu Á, Bữa sáng, Bữa nửa buổi, Bữa trưa, Đồ uống, Bữa tối, Chỗ ngồi, Cửa hàng bán thức ăn mang về, Phục vụ đồ uống có cồn, Dịch vụ bàn",400.000 vnd - 700.000 vnd,106.7200863,10.7240267,"Khu Nghỉ Dưỡng Tajma Sago, Đường Phan Văn Chương, Phường Tân Phú, Quận 7, Thành phố Hồ Chí Minh, 72915, Việt Nam"
1543,Quan Nem Restaurant,+84 28 6299 1478,Đang mở cửa: 10:00 SA - 10:00 CH,4.0,"Kiểu Á, Kiểu Việt, Bữa trưa, Bữa tối, Cửa hàng bán thức ăn mang về, Chỗ ngồi, Phục vụ đồ uống có cồn, Wifi miễn phí, Dịch vụ bàn",400.000 vnd - 700.000 vnd,106.7045393,10.7797681,"Hẻm 17 Đường Thái Văn Lung, Phường Bến Nghé, Quận 1, Thành phố Hồ Chí Minh, 77000, Việt Nam"
1544,Quán Ngói 2,+84 96 507 35 07,Đang mở cửa: 11:00 SA - 11:00 CH,4.0,"Bữa trưa, Bữa tối",400.000 vnd - 700.000 vnd,106.6915504,10.7836778,"Phường Võ Thị Sáu, Quận 3, Thành phố Hồ Chí Minh, 70001, Việt Nam"
1545,Quán Ngon - Bún chả Hà Nội,+84 93 311 22 88,Đang mở cửa: 08:30 SA - 8:30 CH,5.0,"Kiểu Á, Cửa hàng thức ăn ngon, Bản địa, Bữa sáng, Bữa trưa, Bữa tối",400.000 vnd - 700.000 vnd,106.6585799,10.8005558,"Vincom Cộng Hoà, Hẻm 238 Hoàng Văn Thụ, Phường 4, Quận Tân Bình, Thành phố Hồ Chí Minh, 72106, Việt Nam"
1546,Quán Ngự Bình,+84 28 3844 7230,,4.5,Kiểu Việt,100.000 vnd - 400.000 vnd,106.6883835,10.7851819,"Bệnh viện Y học cổ truyền TP.HCM, 179-187, Trần Quốc Toản, Phường Võ Thị Sáu, Quận 3, Thành phố Hồ Chí Minh, 70001, Việt Nam"
1547,Quán Nguyệt,+84 8 3836 4645,Đang mở cửa: 11:00 SA - 11:00 CH,4.5,"Bữa trưa, Bữa tối",400.000 vnd - 700.000 vnd,106.704013,10.7744061,"Nhà Hàng Alibaba, 90, Mạc Thị Bưởi, Phường Bến Nghé, Quận 1, Thành phố Hồ Chí Minh, 00084, Việt Nam"
1548,Quán Nhà Lá,+84 89 911 11 23,Đang đóng cửa:  Xem tất cả giờ,5.0,"Nhà hàng bán bia, Kiểu Việt, Kiểu Bữa tối, Cửa hàng thức ăn ngon, Cà phê, Kiểu Á, Đêm muộn, Đồ uống, Bữa tối",100.000 vnd - 400.000 vnd,106.7385462,10.8028849,"An Cafe, Đường Trần Ngọc Diện, Phường Thảo Điền, Thành phố Thủ Đức, Thành phố Hồ Chí Minh, 71108, Việt Nam"
1549,Quán No.176,Chưa xác thực,,5.0,"Kiểu Việt, Bữa tối, Chỗ ngồi, Dịch vụ bàn",400.000 vnd - 700.000 vnd,106.6951665,10.7688232,"Gaxeo, 132, Đường Nguyễn Thái Học, Phường Cầu Ông Lãnh, Quận 1, Thành phố Hồ Chí Minh, 71010, Việt Nam"
1550,Quán Nông Trại Khoai,+84 28 6285 3757,Đang mở cửa: 4:00 CH - 12:00 SA,5.0,"Quầy bar, Quán rượu, Kiểu Việt, Phù hợp với người ăn chay, Tùy chọn ăn chay",400.000 vnd - 700.000 vnd,106.7309967,10.803336,"Cửa Hàng Pizza 4P's, 48/01, Xuân Thuỷ, Phường Thảo Điền, Thành phố Thủ Đức, Thành phố Hồ Chí Minh, 71108, Việt Nam"
1551,Quán Ốc 236,Chưa xác thực,,4.0,Hải sản,400.000 vnd - 700.000 vnd,106.685982,10.8041964,"Hẻm 72 Đường Phan Đăng Lưu, Phường 5, Quận Phú Nhuận, Thành phố Hồ Chí Minh, 72317, Việt Nam"
1552,Quán Ốc 379,+84 93 317 91 39,Đang mở cửa: 2:30 CH - 11:00 CH,5.0,"Đồ nướng, Kiểu Á, Kiểu Việt, Tốt cho sức khỏe, Thức ăn đường phố, Bữa trưa, Bữa tối",100.000 vnd - 400.000 vnd,106.718552,10.827847,"Tạp Hoá Chị Lệ, Đường Kha Vạn Cân, Phường Hiệp Bình Chánh, Thành phố Thủ Đức, Thành phố Hồ Chí Minh, 50000, Việt Nam"
1553,Quan Oc 49B / Seafood Shop 49B,Chưa xác thực,Đang mở cửa: 4:00 CH - 02:00 SA,4.0,"Hải sản, Kiểu Việt, Bữa tối",400.000 vnd - 700.000 vnd,106.6964563,10.7895126,"Đường Phan Tôn, Phường Đa Kao, Quận 1, Thành phố Hồ Chí Minh, 72210, Việt Nam"
1554,Quán Ốc 63 - Cari Cua & Hải Sản Tươi Sống,+84 28 3940 1279,Đang mở cửa: 3:00 CH - 11:00 CH,4.5,"Kiểu Việt, Bữa trưa, Bữa tối",400.000 vnd - 700.000 vnd,106.6846789,10.7903764,"Phường Võ Thị Sáu, Quận 3, Thành phố Hồ Chí Minh, 70150, Việt Nam"
1555,Quán Oc Khanh,+84 8 3822 0555,,4.5,"Hải sản, Kiểu Việt",400.000 vnd - 700.000 vnd,106.6782306,10.8440256,"72, Đường số 30, Phường 6, Quận Gò Vấp, Thành phố Hồ Chí Minh, 71500, Việt Nam"
1556,Quan Oc Nhu,+84 90 830 30 51,,4.0,Hải sản,400.000 vnd - 700.000 vnd,106.6630621,10.756251,"Parkson Hùng Vương, 126, Hùng Vương, Phường 9, Quận 5, Thành phố Hồ Chí Minh, 73009, Việt Nam"
1557,Quán Orientea,+84 90 963 92 56,Đang mở cửa: 09:00 SA - 10:30 CH,4.5,"Tốt cho sức khỏe, Phù hợp với người ăn chay",20.000 vnd - 99.000 vnd,106.6904384,10.7656297,"Hẻm 268 Bùi Viện, Phường Phạm Ngũ Lão, Quận 1, Thành phố Hồ Chí Minh, 70200, Việt Nam"
1558,Quán Phở Cao Vân,Chưa xác thực,,4.0,"Kiểu Việt, Kiểu Á, Bữa sáng, Bữa nửa buổi, Bữa tối",400.000 vnd - 700.000 vnd,106.6937594,10.7688718,"超棒禮品店, Phạm Ngũ Lão, Phường Phạm Ngũ Lão, Quận 1, Thành phố Hồ Chí Minh, 70200, Việt Nam"
1559,Quán Phở Chay Như,+84 3824 2816,,5.0,"Kiểu Việt, Kiểu Á, Súp, Bữa tối, Bữa trưa, Dịch vụ bàn, Chỗ ngồi",400.000 vnd - 700.000 vnd,106.6406457,10.7891789,"WinMart+, 683A, Đường Âu Cơ, Phường Tân Thành, Quận Tân Phú, Thành phố Hồ Chí Minh, 72012, Việt Nam"
1560,Quán Phở Ông Cả,+84 98 584 83 82,Đang mở cửa: 05:30 SA - 11:00 CH,4.5,"Kiểu Việt, Bữa sáng, Bữa trưa, Bữa tối",400.000 vnd - 700.000 vnd,106.7082017,10.7320534,"Đường Cao Triều Phát, Phường Tân Phong, Quận 7, Thành phố Hồ Chí Minh, 72915, Việt Nam"
1561,Quán Phố Ông Đề,+84 90 813 82 28,Đang mở cửa: 06:30 SA - 12:00 SA,5.0,"Nhà hàng bán bia, Cà phê, Kiểu Á, Quán rượu, Kiểu Việt, Tốt cho sức khỏe, Kiểu Singapore, Bữa sáng, Bữa trưa, Bữa tối, Bữa nửa buổi, Đêm muộn, Đồ uống, Giao hàng, Cửa hàng bán thức ăn mang về, Chỗ ngồi, Phục vụ đồ uống có cồn, Rư",400.000 vnd - 700.000 vnd,106.7131378,10.8106534,"607, Xô Viết Nghệ Tĩnh, Phường 26, Quận Bình Thạnh, Thành phố Hồ Chí Minh, 72309, Việt Nam"
1562,Quán Phở Phú Hương,+84 8 3843 4323,Đang mở cửa: 06:00 SA - 9:00 CH,4.5,"Kiểu Việt, Bữa sáng, Bữa trưa, Bữa tối",400.000 vnd - 700.000 vnd,106.7038615,10.7733531,"Trung tâm mua sắm Sài Gòn Garden, Đường Nguyễn Huệ, Phường Bến Nghé, Quận 1, Thành phố Hồ Chí Minh, 71006, Việt Nam"
1563,Quán Phở Thái Sơn,+84 8 3925 5597,Đang mở cửa: 06:00 SA - 9:00 CH,4.5,"Kiểu Á, Kiểu Việt, Súp, Bữa nửa buổi, Bữa sáng, Bữa trưa, Bữa tối, Đồ uống, Giao hàng, Cửa hàng bán thức ăn mang về, Đặt chỗ, Chỗ ngồi, Có bãi đỗ xe, Bãi đỗ xe đường phố, Đỗ xe có người coi, Bãi đỗ xe tập trung miễn phí, Có ghế ăn ch",400.000 vnd - 700.000 vnd,106.6960082,10.7726975,"Nhà Hàng Saigon Green House, 52, Trương Định, Phường Bến Thành, Quận 1, Thành phố Hồ Chí Minh, 71009, Việt Nam"
1564,Quán Poke Saigon,+84 90 247 43 88,Đang mở cửa: 10:00 SA - 9:00 CH,5.0,"Kiểu Mỹ, Tốt cho sức khỏe, Kiểu Hawai, Hải sản, Phù hợp với người ăn chay, Tùy chọn ăn chay, Tùy chọn đồ ăn không có gluten",100.000 vnd - 400.000 vnd,106.7023554,10.773052,"Manhattan, Tôn Thất Ðạm, Phường Bến Nghé, Quận 1, Thành phố Hồ Chí Minh, 00084, Việt Nam"
1565,Quán Sáu Ốc,+84 28 3836 7163,,4.5,Kiểu Việt,100.000 vnd - 400.000 vnd,106.7403957,10.8052407,"The Snap Cafe, Đường Trần Ngọc Diện, Phường Thảo Điền, Thành phố Thủ Đức, Thành phố Hồ Chí Minh, 71108, Việt Nam"
1566,Quán Sông Trăng,+84 8 3556 2516,,4.0,"Kiểu Á, Kiểu Việt, Phù hợp với người ăn chay, Bữa trưa, Bữa tối",400.000 vnd - 700.000 vnd,106.6961684,10.7832637,"Trạm Xe Bus Hồ Con Rùa, Trần Cao Vân, Phường Võ Thị Sáu, Quận 3, Thành phố Hồ Chí Minh, 77000, Việt Nam"
1567,Quán The Burger Bistro,+84 98 182 87 83,,4.5,"Kiểu Mỹ, Đồ ăn nhanh, Kiểu Anh, Kiểu Úc, Kiểu Canada",400.000 vnd - 700.000 vnd,106.7040115,10.7803876,"Silverland Hotel and Spa, Hẻm 26 Lê Thánh Tôn, Phường Bến Nghé, Quận 1, Thành phố Hồ Chí Minh, 77000, Việt Nam"
1568,Quán Thúy,+84 8 3910 1062,Đang mở cửa: 09:00 SA - 11:00 CH,4.0,"Hải sản, Kiểu Á, Kiểu Việt, Bữa trưa, Bữa tối, Đêm muộn, Cửa hàng bán thức ăn mang về, Chỗ ngồi, Phục vụ đồ uống có cồn",400.000 vnd - 700.000 vnd,106.67274,10.798833,"Newton Residence, Đường Trương Quốc Dung, Phường 8, Quận Phú Nhuận, Thành phố Hồ Chí Minh, 70048, Việt Nam"
1569,Quán Ụt Ụt,+84 28 3744 6947,Đang mở cửa: 11:00 SA - 11:00 CH,4.0,"Thịt nướng, Đồ nướng, Quầy bar, Quán rượu, Bữa trưa, Bữa tối",100.000 vnd - 400.000 vnd,106.7026292,10.7733891,"Nhà Hàng Đồng Nhân, Tôn Thất Thiệp, Phường Bến Nghé, Quận 1, Thành phố Hồ Chí Minh, 00084, Việt Nam"
1570,Quan Ut Ut - Vo Van Kiet,+84 28 3914 4500,Đang mở cửa: 11:00 SA - 11:00 CH,4.5,"Nhà hàng bán bia, Kiểu Mỹ, Quầy bar, Đồ nướng, Tùy chọn đồ ăn không có gluten",100.000 vnd - 400.000 vnd,106.7056005,10.7809888,"Tiệm Spa Miu Miu 3, Hẻm 15 Đường Lê Thánh Tôn, Phường Bến Nghé, Quận 1, Thành phố Hồ Chí Minh, 77000, Việt Nam"
1571,Quán Yến Hương Giang - Bún Bò Huế,Chưa xác thực,,4.5,Món kết hợp,400.000 vnd - 700.000 vnd,106.6920372,10.7891501,"Phuong Mai Vegetarian, Hẻm 82 Võ Thị Sáu, Phường Tân Định, Quận 1, Thành phố Hồ Chí Minh, 72210, Việt Nam"
1572,Quince Eatery,+84 28 3821 8661,Đang mở cửa: 5:30 CH - 11:45 CH,4.5,"Kiểu Địa Trung Hải, Thịt nướng, Kiểu Âu, Phù hợp với người ăn chay, Tùy chọn ăn chay, Tùy chọn đồ ăn không có gluten",400.000 vnd - 700.000 vnd,106.690744,10.778384,"Nhà Hàng Chay Garden, Hẻm 46 Đường Võ Văn Tần, Phường Võ Thị Sáu, Quận 3, Thành phố Hồ Chí Minh, 70001, Việt Nam"
1573,Quốc Ký,+84 90 374 31 09,,5.0,"Kiểu Trung Quốc, Kiểu Việt",20.000 vnd - 99.000 vnd,106.7334385,10.8076683,"Nhà Hàng Lubu, 97B, Hem 95, Phường Thảo Điền, Thành phố Thủ Đức, Thành phố Hồ Chí Minh, 71107, Việt Nam"
1574,Quyen Quyen Restaurant,+84 8 3827 9800,Đang mở cửa: 06:30 SA - 10:30 CH,4.5,"Kiểu Việt, Bữa sáng, Bữa trưa, Bữa tối, Đặt chỗ",400.000 vnd - 700.000 vnd,106.6875083,10.7763383,"the flying rice 🍚Com Niue Sai Gon, 57, Hồ Xuân Hương, Phường Võ Thị Sáu, Quận 3, Thành phố Hồ Chí Minh, 70001, Việt Nam"
1575,RAKU - Japanese Cuisine,+84 8 3824 4562,,4.0,Món kết hợp,400.000 vnd - 700.000 vnd,106.6928978,10.7722554,"Khách Sạn Compass Park View, Đường Nguyễn Du, Phường Bến Thành, Quận 1, Thành phố Hồ Chí Minh, 71009, Việt Nam"
1576,Ramen Bar Suzuki Ho Chi Minh City,+84 126 899 5618,Đang mở cửa: 11:00 SA - 2:00 CH6:00 CH - 11:00 CH,4.0,"Kiểu Nhật, Bữa trưa, Bữa tối",100.000 vnd - 400.000 vnd,106.6969772,10.7691071,"Quán Bar Winking Seal Bia, 50, Ðặng Thị Nhu, Phường Nguyễn Thái Bình, Quận 1, Thành phố Hồ Chí Minh, 71010, Việt Nam"
1577,Ramen Danbo,+84 90 131 53 44,,4.0,"Kiểu Nhật, Kiểu Á, Bữa trưa, Bữa tối, Wifi miễn phí",400.000 vnd - 700.000 vnd,106.70035,10.77416,"artbook store, Đường Lê Lợi, Phường Bến Nghé, Quận 1, Thành phố Hồ Chí Minh, 71006, Việt Nam"
