id,name,phone,timeOpen,ratingAverage,details,rangePrice,Longitude,Latitude,address
1011,MiYu Dim Sum,+84 91 935 66 63,Đang mở cửa: 07:00 SA - 1:30 CH5:00 CH - 9:00 CH,5.0,"Hải sản, Đồ ăn nhanh, Cửa hàng thức ăn ngon, Tốt cho sức khỏe, Kiểu Trung Quốc, Kiểu Á, Kiểu Singapore, Bữa sáng, Bữa trưa, Bữa tối, Bữa nửa buổi, Đồ uống",100.000 vnd - 400.000 vnd,106.7050195,10.7757336,"Du Lịch Nam Trip, 34, Mạc Thị Bưởi, Phường Bến Nghé, Quận 1, Thành phố Hồ Chí Minh, 00084, Việt Nam"
1012,MJ's Kitchen,+84 97 784 42 74,,4.5,"Kiểu Á, Kiểu Hàn Quốc",400.000 vnd - 700.000 vnd,106.6920916,10.7795106,"Bảo tàng Chứng tích Chiến tranh, 28, Đường Võ Văn Tần, Phường Võ Thị Sáu, Quận 3, Thành phố Hồ Chí Minh, 70001, Việt Nam"
1013,Mo Mo Paradise,+84 38272166,Đang mở cửa: 11:00 SA - 11:00 CH,4.0,"Kiểu Nhật, Kiểu Á, Phù hợp với người ăn chay, Bữa trưa, Bữa tối",400.000 vnd - 700.000 vnd,106.6929438,10.7609807,"Phường Cô Giang, Quận 1, Thành phố Hồ Chí Minh, 71010, Việt Nam"
1014,Mộc Cafe,+84 8 6659 5522,Đang mở cửa: 12:00 SA - 11:59 CH,4.5,"Bữa sáng, Bữa trưa, Bữa tối",400.000 vnd - 700.000 vnd,106.7067284,10.7825878,"Trạm Xe Bus Khoa Sư Phạm Đại Học Sài Gòn, Nguyễn Hữu Cảnh, Phường Bến Nghé, Quận 1, Thành phố Hồ Chí Minh, 77000, Việt Nam"
1015,Mộc Riêu Nướng,+84 90 928 20 96,Đang mở cửa: 06:30 SA - 11:00 CH,4.0,"Kiểu Trung Quốc, Đồ nướng, Đương đại, Kiểu Việt, Kiểu Á, Phù hợp với người ăn chay, Tùy chọn ăn chay",100.000 vnd - 400.000 vnd,106.7007485,10.7747415,"Khách sạn Liberty Central Sài Gòn CityPoint, 59 - 61, Đường Pasteur, Phường Bến Nghé, Quận 1, Thành phố Hồ Chí Minh, 00084, Việt Nam"
1016,Modern Classic Cafe,+84 28 5411 1135,Đang mở cửa: 07:00 SA - 10:00 CH,4.5,"Cà phê, Kiểu Anh, Bữa sáng, Bữa trưa, Bữa tối, Bữa nửa buổi, Đồ uống",100.000 vnd - 400.000 vnd,106.7043402,10.7799532,"Tous Les Jours, Đường Lê Thánh Tôn, Phường Bến Nghé, Quận 1, Thành phố Hồ Chí Minh, 77000, Việt Nam"
1017,Mojo Boutique Coffee,+84 896 889 556,Đang mở cửa: 07:30 SA - 10:30 CH,5.0,"Kiểu Anh, Bữa sáng, Bữa trưa, Bữa tối",400.000 vnd - 700.000 vnd,106.6970187,10.7685651,"Pho Cong, Đường Ký Con, Phường Nguyễn Thái Bình, Quận 1, Thành phố Hồ Chí Minh, 71010, Việt Nam"
1018,Moku Japanese Restaurant,+84 28 3519 3737,Đang mở cửa: 11:00 SA - 2:00 CH5:00 CH - 10:00 CH,4.0,"Kiểu Nhật, Bữa trưa, Bữa tối",700.000 vnd - 1.000.000 vnd,106.659181,10.796992,"Hẻm 4 Hoàng Việt, Phường 4, Quận Tân Bình, Thành phố Hồ Chí Minh, 72106, Việt Nam"
1019,Mom Cook Restaurant,+84 8 6654 3838,Đang mở cửa: 10:00 SA - 10:00 CH,4.5,"Kiểu Việt, Bữa trưa, Bữa tối",100.000 vnd - 400.000 vnd,106.7028556,10.7625519,"Chùa Phật Bửu, Hoàng Diệu, Phường 8, Quận 4, Thành phố Hồ Chí Minh, 72806, Việt Nam"
1020,Mom's Chicken,+84 8 6295 9272,Đang mở cửa: 11:00 SA - 02:00 SA,4.5,"Hải sản, Kiểu Á, Kiểu Việt, Kiểu Bữa tối, Kiểu Trung Á, Kiểu Hàn Quốc, Bữa trưa, Bữa tối",100.000 vnd - 400.000 vnd,106.6930443,10.7684171,"Khách Sạn Mai Phai, Phạm Ngũ Lão, Phường Phạm Ngũ Lão, Quận 1, Thành phố Hồ Chí Minh, 70200, Việt Nam"
1021,Mon Hue Restaurant,+84 8 2216 2208,,3.5,"Kiểu Á, Kiểu Việt, Bữa trưa, Bữa tối, Bữa nửa buổi, Đêm muộn, Giao hàng, Cửa hàng bán thức ăn mang về, Chỗ ngồi, Phục vụ đồ uống có cồn, Dịch vụ bàn",400.000 vnd - 700.000 vnd,106.694844,10.7679902,"Khách Sạn Liên Hà, Hẻm 12 Bùi Viện, Phường Phạm Ngũ Lão, Quận 1, Thành phố Hồ Chí Minh, 71010, Việt Nam"
1022,Món Ngon Đường Phố,38241246,,4.0,Đồ ăn nhanh,400.000 vnd - 700.000 vnd,106.695201,10.7689383,"Trường THPT Ernst Thälmann, 8, Trần Hưng Ðạo, Phường Phạm Ngũ Lão, Quận 1, Thành phố Hồ Chí Minh, 71010, Việt Nam"
1023,Món Quen Việt,+84 778 994 745,,5.0,Món kết hợp,400.000 vnd - 700.000 vnd,106.6838395,10.7685536,"Bánh Cuốn Hải Nam, 11A, Cao Thắng, Phường 2, Quận 3, Thành phố Hồ Chí Minh, 72406, Việt Nam"
1024,MON Restaurant & Bar,Chưa xác thực,Đang đóng cửa:  Xem tất cả giờ,4.5,"Quốc tế, Bữa trưa, Bữa tối, Đặt chỗ",400.000 vnd - 700.000 vnd,106.6856277,10.7765665,"FnBS Marketing, 3, Đường Lê Ngô Cát, Phường Võ Thị Sáu, Quận 3, Thành phố Hồ Chí Minh, 70001, Việt Nam"
1025,Món Việt,+84 8 6680 9183,,4.0,"Kiểu Á, Kiểu Việt, Phù hợp với người ăn chay, Tùy chọn ăn chay, Bữa trưa, Bữa tối, Bữa nửa buổi",400.000 vnd - 700.000 vnd,106.7043797,10.7746964,"Katinat - Đồng Khởi, Đường Ðồng Khởi, Phường Bến Nghé, Quận 1, Thành phố Hồ Chí Minh, 71006, Việt Nam"
1026,Món Việt 88,+84 99 788 11 88,Đang mở cửa: 09:30 SA - 10:00 CH,4.0,"Cửa hàng thức ăn ngon, Bữa trưa, Bữa tối",100.000 vnd - 400.000 vnd,106.6979095,10.7735654,"Cà Phê F.r.i.e.n.d.s, 24/8, Hẻm 24 Thủ Khoa Huân, Phường Bến Thành, Quận 1, Thành phố Hồ Chí Minh, 71009, Việt Nam"
1027,Món Việt Quán,+84 8 3834 4660,,4.0,Kiểu Việt,100.000 vnd - 400.000 vnd,106.6845303,10.7864359,"Phở Bò Phú Gia, Hẻm 148 Lý Chính Thắng, Phường Võ Thị Sáu, Quận 3, Thành phố Hồ Chí Minh, 70150, Việt Nam"
1028,Moo Beef Steak,+84 96 341 92 68,Đang mở cửa: 10:30 SA - 2:30 CH5:00 CH - 10:30 CH,5.0,"Kiểu Mỹ, Nhà hàng bít tết, Món kết hợp, Tốt cho sức khỏe, Bữa trưa, Bữa tối, Đồ uống",400.000 vnd - 700.000 vnd,106.7102001,10.7900874,"Bác Sĩ Phạm Đình Hòa, Đường Phạm Viết Chánh, Phường 19, Quận Bình Thạnh, Thành phố Hồ Chí Minh, 77000, Việt Nam"
1029,Moo Beef Steak - Prime,+84 28 3822 8628,Đang mở cửa: 10:30 SA - 2:00 CH5:00 CH - 10:00 CH,5.0,"Nhà hàng bít tết, Phù hợp với người ăn chay, Tùy chọn đồ ăn không có gluten, Bữa trưa, Bữa tối, Đồ uống",400.000 vnd - 700.000 vnd,106.7036262,10.7785215,"Tổng cục Hải quan, Thi Sách, Phường Bến Nghé, Quận 1, Thành phố Hồ Chí Minh, 77000, Việt Nam"
1030,Moo Beef Steak 109 Ly Tu Trong,+84 96 598 98 35,Đang mở cửa: 10:30 SA - 2:00 CH5:00 CH - 10:00 CH,5.0,"Nhà hàng bít tết, Bữa trưa, Bữa tối",400.000 vnd - 700.000 vnd,106.704883,10.779633,"Hẻm 8A Đường Thái Văn Lung, Phường Bến Nghé, Quận 1, Thành phố Hồ Chí Minh, 77000, Việt Nam"
1031,Morico,+84 28 6298 9179,,4.0,"Kiểu Nhật, Cà phê, Kiểu Á, Món kết hợp, Tốt cho sức khỏe, Đặt chỗ",400.000 vnd - 700.000 vnd,106.6970323,10.7725721,"Bar's Bar, 47, Phan Chu Trinh, Phường Bến Thành, Quận 1, Thành phố Hồ Chí Minh, 71009, Việt Nam"
1032,Motown Sài Gòn,+84 8 3821 1368,,4.5,"Đồ ăn nhanh, Kiểu Việt, Giao hàng, Cửa hàng bán thức ăn mang về, Đặt chỗ, Ngồi ngoài trời, Bữa ăn tự chọn, Chỗ ngồi, Phục vụ đồ uống có cồn, Quầy bar đầy đủ, Rượu và bia, Chấp nhận thẻ Mastercard, Chấp nhận thẻ Visa, Chỉ chấp nhận tiền",400.000 vnd - 700.000 vnd,106.6738278,10.7586712,"Phường 9, Quận 5, Thành phố Hồ Chí Minh, 73009, Việt Nam"
1033,Movers and Shakers - Neighborhood Cocktail Bar,+84 90 674 03 32,,4.5,"Pizza, Kiểu Việt, Đồ uống, Ngồi ngoài trời, Chấp nhận thẻ tín dụng",400.000 vnd - 700.000 vnd,106.6892932,10.7752722,"Quán Bún Chả Hà Nội, Đường Võ Văn Tần, Phường Võ Thị Sáu, Quận 3, Thành phố Hồ Chí Minh, 70001, Việt Nam"
1034,Mr Beer,+84 90 985 48 41,Đang mở cửa: 10:30 SA - 11:30 CH,4.0,"Nhà hàng bít tết, Nhà hàng bán bia, Kiểu Âu, Kiểu Á, Quán rượu, Nhà hàng bia, Bữa trưa, Bữa tối, Đồ uống",400.000 vnd - 700.000 vnd,106.6923336,10.7869868,"Cà Phê Cy Cy, 52, Đường Trương Quyền, Phường Võ Thị Sáu, Quận 3, Thành phố Hồ Chí Minh, 72210, Việt Nam"
1035,Mr Green,+84 93 809 39 92,Đang mở cửa: 06:00 SA - 10:00 CH,5.0,"Cà phê, Kiểu Việt, Bữa sáng, Bữa trưa, Bữa tối, Cửa hàng bán thức ăn mang về, Ngồi ngoài trời",400.000 vnd - 700.000 vnd,106.700243,10.729419,"Đường Nguyễn Hữu Thọ, Phường Tân Phong, Quận 7, Thành phố Hồ Chí Minh, 72915, Việt Nam"
1036,Mr. BBQ & SsAm,+84 8 5410 7575,Đang mở cửa: 07:00 SA - 9:00 CH,4.0,"Đồ nướng, Kiểu Á, Kiểu Hàn Quốc, Món kết hợp, Kiểu Việt, Bữa sáng, Bữa trưa, Bữa tối",100.000 vnd - 400.000 vnd,106.6739869,10.7750335,"VFF, Đường Cao Thắng, Phường 12, Quận 10, Thành phố Hồ Chí Minh, 72406, Việt Nam"
1037,Mr. Bistek,+84 78 429 2988,,5.0,Nhà hàng bít tết,400.000 vnd - 700.000 vnd,106.7003604,10.7890314,"Koto Saigon Training Testaurant, 19, Nguyễn Đình Chiểu, Phường Đa Kao, Quận 1, Thành phố Hồ Chí Minh, 77000, Việt Nam"
1038,Mr. Park,+84 8 6261 7733,Đang mở cửa: 11:00 SA - 11:00 CH,4.5,"Đồ nướng, Kiểu Á, Kiểu Hàn Quốc, Bữa trưa, Bữa tối, Bữa nửa buổi, Đặt chỗ, Chỗ ngồi, Dịch vụ bàn",400.000 vnd - 700.000 vnd,106.7404879,10.8062567,"Số 6, Phường Thảo Điền, Thành phố Thủ Đức, Thành phố Hồ Chí Minh, 71108, Việt Nam"
1039,Mr. Singh Indian Restaurant,+84 90 848 00 05,Đang mở cửa: 5:00 CH - 9:30 CH,4.5,"Kiểu Ấn Độ, Phù hợp với người ăn chay, Tùy chọn ăn chay, Bữa trưa, Bữa tối",400.000 vnd - 700.000 vnd,106.691666,10.7643345,"Khách Sạn Pullman Saigon Centre, Trần Hưng Ðạo, Phường Nguyễn Cư Trinh, Quận 1, Thành phố Hồ Chí Minh, 70200, Việt Nam"
1040,MUILLIGA'S SAIGON,+84 79 717 2468,Đang mở cửa: 11:00 SA - 10:00 CH,5.0,"Pizza, Món kết hợp, Bữa sáng, Bữa trưa, Bữa tối, Bữa nửa buổi, Đồ uống",100.000 vnd - 400.000 vnd,106.6957942,10.771372,"The drunken pot, Phạm Hồng Thái, Phường Bến Thành, Quận 1, Thành phố Hồ Chí Minh, 71009, Việt Nam"
1041,Mumtaz Indian Restaurant,+84 8 3837 1767,Đang mở cửa: 11:00 SA - 11:00 CH,4.5,"Kiểu Ấn Độ, Kiểu Á, Phù hợp với người ăn chay, Tùy chọn ăn chay, Thịt kiểu Hồi giáo, Tùy chọn đồ ăn không có gluten, Bữa trưa, Bữa tối, Bữa nửa buổi, Đêm muộn",400.000 vnd - 700.000 vnd,106.7043059,10.7739756,"chung cư 42 Nguyễn Huệ, Đường Nguyễn Huệ, Phường Bến Nghé, Quận 1, Thành phố Hồ Chí Minh, 71006, Việt Nam"
1042,Musa - Cà Ri Ấn Độ,+84 8 3886 6679,,4.0,"Kiểu Á, Kiểu Ấn Độ, Tốt cho sức khỏe",400.000 vnd - 700.000 vnd,106.6937533,10.7685858,"Khách Sạn Fullmoon, Hẻm 185 Phạm Ngũ Lão, Phường Phạm Ngũ Lão, Quận 1, Thành phố Hồ Chí Minh, 70200, Việt Nam"
1043,Mustard The Indian Restaurant,+84 37 351 2773,Đang mở cửa: 10:00 SA - 2:30 CH5:00 CH - 10:30 CH,5.0,"Kiểu Trung Quốc, Kiểu Ấn Độ, Đồ nướng, Kiểu Nepal, Kiểu Á, Bữa tối, Bữa sáng, Bữa trưa, Bữa nửa buổi, Đồ uống, Dịch vụ bàn, Giao hàng, Đặt chỗ, Chỗ ngồi, Có bãi đỗ xe, Bãi đỗ xe tập trung miễn phí, Phục vụ đồ uống có cồn, Rượu và bia, Wif",400.000 vnd - 700.000 vnd,106.6961223,10.7730563,"East West Brewing Co, Đường Lý Tự Trọng, Phường Bến Thành, Quận 1, Thành phố Hồ Chí Minh, 71009, Việt Nam"
1044,Mutsumian,+84 8 3824 8457,,4.0,Món kết hợp,400.000 vnd - 700.000 vnd,106.6899069,10.771542,"Khách Sạn Icon 36, Đường Bùi Thị Xuân, Phường Bến Thành, Quận 1, Thành phố Hồ Chí Minh, 70200, Việt Nam"
1045,My Banh Mi,+84 28 3827 2145,Đang đóng cửa:  Xem tất cả giờ,4.5,"Kiểu Việt, Tốt cho sức khỏe, Tùy chọn ăn chay",100.000 vnd - 400.000 vnd,106.6919765,10.7787724,"Trường Mầm non Thành phố, 4, Đường Trần Quốc Thảo, Phường Võ Thị Sáu, Quận 3, Thành phố Hồ Chí Minh, 70001, Việt Nam"
1046,My House Bar,+84 8 3822 5855,Đang mở cửa: 11:00 SA - 01:00 SA,4.5,"Kiểu Mexico, Kiểu Bữa tối, Quầy bar, Quán rượu, Bữa trưa, Bữa tối, Bữa nửa buổi",100.000 vnd - 400.000 vnd,106.7026177,10.7755911,"Nhà Hàng Saigon Garden, 99, Đường Nguyễn Huệ, Phường Bến Nghé, Quận 1, Thành phố Hồ Chí Minh, 71006, Việt Nam"
1047,My Mother Restaurant,+84 28 3911 1262,Đang mở cửa: 10:00 SA - 10:00 CH,4.5,"Kiểu Âu, Kiểu Việt, Bữa trưa, Bữa tối, Bữa nửa buổi, Đồ uống",100.000 vnd - 400.000 vnd,106.6968026,10.7714077,"Bưu Điện Lê Lai, Đường Lê Lai, Phường Bến Thành, Quận 1, Thành phố Hồ Chí Minh, 71009, Việt Nam"
1048,My Record Bar Saigon,+84 93 424 84 04,,4.5,"Kiểu Trung Quốc, Kiểu Mỹ, Kiểu Thái, Kiểu Việt",100.000 vnd - 400.000 vnd,106.7104858,10.7901299,"Nhà Hàng Chuck's Burgers PVC, 46, Phạm Viết Chánh, Phường 19, Quận Bình Thạnh, Thành phố Hồ Chí Minh, 77000, Việt Nam"
1049,Myung Ga Korean Restaurant,Chưa xác thực,,3.5,"Kiểu Á, Kiểu Hàn Quốc",400.000 vnd - 700.000 vnd,106.6871513,10.7709446,"Bahn Mi Chim Chay, Nguyễn Thị Minh Khai, Phường Phạm Ngũ Lão, Quận 1, Thành phố Hồ Chí Minh, 70200, Việt Nam"
1050,MZ Club,+84 906025658,Mở cửa sau 25 phút nữa:  Xem tất cả giờ,4.0,"Quầy bar, Kiểu Âu, Quán rượu, Kiểu Việt, Bữa tối, Bữa sáng, Bữa trưa, Bữa nửa buổi, Đêm muộn, Đồ uống, Đặt chỗ, Chỗ ngồi, Phục vụ đồ uống có cồn, Quầy bar đầy đủ, Wifi miễn phí, Ngồi ngoài trời, Ăn tối phòng riêng, Bãi đỗ xe đường phố",400.000 vnd - 700.000 vnd,106.7029056,10.7717361,"Chợ cũ Tôn Thất Đạm, Huỳnh Thúc Kháng, Phường Bến Nghé, Quận 1, Thành phố Hồ Chí Minh, 00084, Việt Nam"
1051,MZ Restaurant,+84 90 602 56 58,Đang mở cửa: 07:00 SA - 12:00 SA,4.5,"Kiểu Âu, Kiểu Á, Quốc tế, Phù hợp với người ăn chay",100.000 vnd - 400.000 vnd,106.6981854,10.7787447,"Cà Phê Au Parc, 32, Đường Hàn Thuyên, Phường Bến Nghé, Quận 1, Thành phố Hồ Chí Minh, 71006, Việt Nam"
1052,Na Hang,Chưa xác thực,,4.0,"Kiểu Việt, Đặt chỗ",400.000 vnd - 700.000 vnd,106.7036128,10.7762617,"Khách sạn Caravelle Saigon, Công Trường Lam Sơn, Phường Bến Nghé, Quận 1, Thành phố Hồ Chí Minh, 71006, Việt Nam"
1053,NaKaThai Thảo Điền,+84 28 3519 0398,Đang mở cửa: 10:00 SA - 2:00 CH6:00 CH - 10:00 CH,5.0,"Kiểu Thái, Kiểu Á, Bữa trưa, Bữa tối, Đồ uống",100.000 vnd - 400.000 vnd,106.7043759,10.7717064,"Bitexco Financial Tower, 02, Hải Triều, Phường Bến Nghé, Quận 1, Thành phố Hồ Chí Minh, 00084, Việt Nam"
1054,Naked Sushi & Sashimi,+84 93 671 10 13,,5.0,Sushi,400.000 vnd - 700.000 vnd,106.7035966,10.7780363,"Nhà Hàng El Gaucho, Đường Hai Bà Trưng, Phường Bến Nghé, Quận 1, Thành phố Hồ Chí Minh, 71006, Việt Nam"
1055,Nam An - Nhà Hàng Việt,+84 8 3824 3099,Đang mở cửa: 11:00 SA - 10:00 CH,4.5,"Bữa trưa, Bữa tối",400.000 vnd - 700.000 vnd,106.7028883,10.7798036,"Shamballa vegetarian, restaurant & lounge - Saigon, 31, Đường Lý Tự Trọng, Phường Bến Nghé, Quận 1, Thành phố Hồ Chí Minh, 77000, Việt Nam"
1056,Nam du,+84 8 3820 5021,,3.5,"Kiểu Việt, Bữa trưa, Bữa tối, Đặt chỗ, Chỗ ngồi, Dịch vụ bàn",400.000 vnd - 700.000 vnd,106.7465677,10.8054268,"Trường Tiểu Học Quốc Tế Hồ Chí Minh, 28, Đường Võ Trường Toản, Phường An Phú, Thành phố Thủ Đức, Thành phố Hồ Chí Minh, 70000, Việt Nam"
1057,Nam Phan,+84 8 3933 3636,,3.5,"Kiểu Á, Kiểu Việt, Bữa tối, Bữa sáng, Bữa trưa, Đêm muộn, Đặt chỗ, Chỗ ngồi, Phục vụ đồ uống có cồn, Dịch vụ bàn",400.000 vnd - 700.000 vnd,106.7039368,10.7770723,"Cây đàn Việt Nam, Công Trường Lam Sơn, Phường Bến Nghé, Quận 1, Thành phố Hồ Chí Minh, 71006, Việt Nam"
1058,Nam son,Chưa xác thực,,4.0,"Nhà hàng bít tết, Đồ ăn nhanh, Kiểu Việt, Bữa trưa, Bữa tối, Chỗ ngồi, Dịch vụ bàn",400.000 vnd - 700.000 vnd,106.7005216,10.7791736,"Papermoney, Đường Nguyễn Du, Phường Bến Nghé, Quận 1, Thành phố Hồ Chí Minh, 71006, Việt Nam"
1059,Namara Hokkaido,+84 28 2253 9332,,4.5,Kiểu Nhật,700.000 vnd - 1.000.000 vnd,106.7036262,10.7785215,"Tổng cục Hải quan, Thi Sách, Phường Bến Nghé, Quận 1, Thành phố Hồ Chí Minh, 77000, Việt Nam"
1060,Nàng Gánh Restaurant,+84 90 333 03 32,Đang mở cửa: 08:00 SA - 10:00 CH,4.5,"Kiểu Việt, Cửa hàng thức ăn ngon, Tốt cho sức khỏe, Phù hợp với người ăn chay, Tùy chọn ăn chay",100.000 vnd - 400.000 vnd,106.6735664,10.7552405,"Hẻm 409 Nguyễn Trãi, Phường 7, Quận 5, Thành phố Hồ Chí Minh, 73009, Việt Nam"
1061,Nắng Vietnamese Fusion Foods,+84 28 3837 1881,Đang mở cửa: 10:00 SA - 10:30 CH,5.0,"Cà phê, Kiểu Việt, Phù hợp với người ăn chay, Tùy chọn ăn chay",100.000 vnd - 400.000 vnd,106.6893163,10.7886725,"Hẻm 29 Đường Trần Quốc Toản, Phường Võ Thị Sáu, Quận 3, Thành phố Hồ Chí Minh, 72210, Việt Nam"
1062,Nanna's Kitchen,+84 93 310 59 99,,4.5,Kiểu Việt,20.000 vnd - 99.000 vnd,106.6923968,10.7715226,"Bánh Mì Huynh Hoa, 26, Đường Lê Thị Riêng, Phường Bến Thành, Quận 1, Thành phố Hồ Chí Minh, 70200, Việt Nam"
1063,Napoly,8290583,,4.0,"Quầy bar, Quán rượu, Cà phê, Bữa trưa, Bữa tối, Đặt chỗ, Chỗ ngồi, Phục vụ đồ uống có cồn, Dịch vụ bàn, Nhạc sống",400.000 vnd - 700.000 vnd,106.7029689,10.7788739,"Khách Sạn The Spring, 44, Lê Thánh Tôn, Phường Bến Nghé, Quận 1, Thành phố Hồ Chí Minh, 71006, Việt Nam"
1064,Nara Thai Saigon Centre,+84 28 3821 8808,,3.5,"Kiểu Thái, Kiểu Á, Phù hợp với người ăn chay, Tùy chọn ăn chay",100.000 vnd - 400.000 vnd,106.6984256,10.7646348,"Quan Ut Ut American BBQ, Đường Võ Văn Kiệt, Phường Cầu Ông Lãnh, Quận 1, Thành phố Hồ Chí Minh, 71010, Việt Nam"
1065,Nataraj Cuisine of India,+84 93 328 05 38,,4.0,"Kiểu Ấn Độ, Kiểu Á, Bữa trưa, Bữa tối, Đặt chỗ, Dịch vụ bàn, Chỗ ngồi",400.000 vnd - 700.000 vnd,106.705988,10.7731929,"Majestic Hotel, Đường Ðồng Khởi, Phường Bến Nghé, Quận 1, Thành phố Hồ Chí Minh, 71006, Việt Nam"
1066,Natrix Bar,+84 97 342 11 11,Mở cửa sau 16 phút nữa:  Xem tất cả giờ,5.0,"Quầy bar, Quốc tế, Quán rượu, Quán bar phục vụ đồ ăn, Quán rượu đặc sản, Bữa tối, Đêm muộn, Đồ uống, Bãi đỗ xe tập trung miễn phí, Quầy bar đầy đủ, Rượu và bia, Thanh toán điện tử, Wifi miễn phí, Chấp nhận thẻ tín dụng, Nhạc sống",400.000 vnd - 700.000 vnd,106.6905392,10.7688943,"Khách Sạn Inn Saigon, 200, Đường Lê Lai, Phường Bến Thành, Quận 1, Thành phố Hồ Chí Minh, 70200, Việt Nam"
1067,Nâu Sài Gòn,+84 78 776 2668,,5.0,"Kiểu Á, Cửa hàng thức ăn ngon, Thịt nướng, Kiểu Việt, Tốt cho sức khỏe",20.000 vnd - 99.000 vnd,106.6765799,10.7564039,"279, Đường Nguyễn Trãi, Phường 3, Quận 5, Thành phố Hồ Chí Minh, 73009, Việt Nam"
1068,Nâunâu,+84 90 870 95 43,Đóng cửa sau 39 phút nữa:  Xem tất cả giờ,5.0,"Cà phê, Kiểu Việt, Tốt cho sức khỏe, Súp, Bữa sáng, Bữa trưa, Bữa tối, Bữa nửa buổi, Đêm muộn, Cửa hàng bán thức ăn mang về, Đặt chỗ, Ngồi ngoài trời, Có bãi đỗ xe, Bãi đỗ xe đường phố, Bãi đỗ xe tập trung miễn phí, Có ghế ăn cho bé",400.000 vnd - 700.000 vnd,106.6924602,10.7824683,"Sherwood Suites, Nam Kỳ Khởi Nghĩa, Phường Võ Thị Sáu, Quận 3, Thành phố Hồ Chí Minh, 70001, Việt Nam"
1069,Neko Việt Nam - Japanese food,+84 90 819 06 87,Đang mở cửa: 11:00 SA - 10:00 CH,4.0,"Kiểu Nhật, Sushi, Bữa trưa, Bữa tối",100.000 vnd - 400.000 vnd,106.6925081,10.7677071,"thank thuong, Hẻm 241 Phạm Ngũ Lão, Phường Phạm Ngũ Lão, Quận 1, Thành phố Hồ Chí Minh, 70200, Việt Nam"
1070,Nếp Restaurant,+84 91 505 59 23,,4.5,"Kiểu Á, Kiểu Việt, Món kết hợp, Phù hợp với người ăn chay, Tùy chọn ăn chay, Bữa trưa, Bữa tối, Bữa nửa buổi",400.000 vnd - 700.000 vnd,106.7047491,10.7823699,"CB, Đường Lý Tự Trọng, Phường Bến Nghé, Quận 1, Thành phố Hồ Chí Minh, 77000, Việt Nam"
1071,New York Deli,+84 97 780 59 53,,5.0,"Kiểu Mỹ, Quầy bar, Kiểu Á, Quán rượu",100.000 vnd - 400.000 vnd,106.7060127,10.78122,"Nhà Hàng Mandarine, 11A, Ngô Văn Năm, Phường Bến Nghé, Quận 1, Thành phố Hồ Chí Minh, 77000, Việt Nam"
1072,New York Steakhouse,+84 8 3823 7373,Đang mở cửa: 11:00 SA - 10:30 CH,4.0,"Kiểu Mỹ, Nhà hàng bít tết, Bữa trưa, Bữa tối, Đêm muộn",700.000 vnd - 1.000.000 vnd,106.6997155,10.7707315,"VP, Hàm Nghi, Phường Nguyễn Thái Bình, Quận 1, Thành phố Hồ Chí Minh, 71010, Việt Nam"
1073,NEX Restaurant & Cafe,+84 90 288 72 76,,5.0,"Cà phê, Kiểu Việt, Kiểu Á, Bữa trưa, Bữa tối, Dịch vụ bàn, Đặt chỗ, Chỗ ngồi",400.000 vnd - 700.000 vnd,106.6985304,10.7773114,"Chung cư 89-91 Pasteur, Đường Nguyễn Du, Phường Bến Nghé, Quận 1, Thành phố Hồ Chí Minh, 71006, Việt Nam"
1074,Ngan Dinh Restaurant,+84 28 3830 8888,Đang mở cửa: 07:00 SA - 2:00 CH5:00 CH - 10:00 CH,4.0,"Kiểu Trung Quốc, Kiểu Á, Phù hợp với người ăn chay, Bữa trưa, Bữa tối",400.000 vnd - 700.000 vnd,106.6900218,10.7717458,"Khách Sạn EdenStar Sài Gòn, 38, Bùi Thị Xuân, Phường Bến Thành, Quận 1, Thành phố Hồ Chí Minh, 70200, Việt Nam"
1075,Nghi Xuan,+84 8 3823 0699,Đang mở cửa: 10:00 SA - 10:00 CH,4.0,"Kiểu Việt, Kiểu Á, Phù hợp với người ăn chay, Bữa trưa, Bữa tối",400.000 vnd - 700.000 vnd,106.6819757,10.7811412,"BacA Bank, 123, Đường Bà Huyện Thanh Quan, Phường 9, Quận 3, Thành phố Hồ Chí Minh, 70150, Việt Nam"
1076,NGO - SAIGON CENTRE,+84 8 3821 8771,Đang mở cửa: 10:30 SA - 9:30 CH,4.0,"Kiểu Việt, Kiểu Á, Phù hợp với người ăn chay, Tùy chọn ăn chay",100.000 vnd - 400.000 vnd,106.700798,10.7732879,"Trung tâm mua sắm Saigon Centre, Nam Kỳ Khởi Nghĩa, Phường Bến Nghé, Quận 1, Thành phố Hồ Chí Minh, 00084, Việt Nam"
1077,Ngõ 89,+84 90 449 18 88,,4.5,"Kiểu Việt, Kiểu Á, Phù hợp với người ăn chay, Bữa tối, Bữa trưa",400.000 vnd - 700.000 vnd,106.7102326,10.7275182,"Cửa Hàng Xe Đạp Bike Life, 83, Đường Phạm Thái Bường, Phường Tân Phong, Quận 7, Thành phố Hồ Chí Minh, 72915, Việt Nam"
1078,Ngõ 90,+84 787 681 990,Đang mở cửa: 07:00 SA - 11:00 CH,5.0,"Cửa hàng thức ăn ngon, Kiểu Việt, Bản địa, Bữa sáng, Bữa trưa, Bữa tối",400.000 vnd - 700.000 vnd,106.6922101,10.7819419,"Cửa Hàng Thời Trang PT2000, Nam Kỳ Khởi Nghĩa, Phường Võ Thị Sáu, Quận 3, Thành phố Hồ Chí Minh, 70001, Việt Nam"
1079,Ngoc Suong Hai San & Bar,+84 88 859 93 99,Đang mở cửa: 10:00 SA - 11:00 CH,4.5,"Hải sản, Kiểu Âu, Kiểu Á, Kiểu Việt, Kiểu Bữa tối, Bữa tối, Bữa trưa, Bữa nửa buổi, Đêm muộn, Đồ uống",1612358 vnd - 5.000.000 vnd,106.7575179,10.7769192,"Chung cư Vista Verde, 2, Nguyễn Thanh Sơn, Phường Thạnh Mỹ Lợi, Thành phố Thủ Đức, Thành phố Hồ Chí Minh, 08408, Việt Nam"
1080,Ngoc Suong Sai Gon (Hoang Viet),+84 28 3844 1951,Đang mở cửa: 10:00 SA - 10:00 CH,4.0,"Hải sản, Kiểu Á, Kiểu Việt, Món kết hợp, Kiểu Bữa tối, Bữa tối, Bữa trưa, Đồ uống, Đặt chỗ, Chỗ ngồi, Bữa ăn tự chọn, Đỗ xe có người coi, Có ghế ăn cho bé, Phục vụ đồ uống có cồn, Chấp nhận thẻ Visa, Wifi miễn phí, Chấp nhận thẻ tín dụ",400.000 vnd - 700.000 vnd,106.6887635,10.766283,"171, Đường Cống Quỳnh, Phường Nguyễn Cư Trinh, Quận 1, Thành phố Hồ Chí Minh, 70200, Việt Nam"
